ID,Subreddit,Title,Upvote,Score,Comments,Edited,URL,Flair Text,Nums of Comment
uw3f46,houseplants,I feel attacked.,0.94,63531,<praw.models.comment_forest.CommentForest object at 0x7f9558c1a140>,False,https://i.redd.it/xrxepgbkz8191.jpg,HUMOR/FLUFF,793
v4z9xu,houseplants,The liberals are trying to make my plants gay!!,0.81,54047,<praw.models.comment_forest.CommentForest object at 0x7f95171bffa0>,False,https://v.redd.it/nkug83zugo391,HUMOR/FLUFF,1280
q0hqvn,houseplants,This was supposed to be a plant progress post showing off my oxalis but Henk stole the show,0.96,45005,<praw.models.comment_forest.CommentForest object at 0x7f95171c8070>,False,https://i.redd.it/206u7feyl8r71.jpg,PETS AND PLANTS,566
i5rplr,houseplants,My grandpa made me a plant stand 💖,0.96,40057,<praw.models.comment_forest.CommentForest object at 0x7f950de47fd0>,False,https://i.redd.it/sfn9fnke1pf51.jpg,FAMILY PHOTO,451
lkjvss,houseplants,I let my Golden Pothos get outta hand for just this reason. It’s like a little jungle for him.,0.98,39556,<praw.models.comment_forest.CommentForest object at 0x7f950de4c160>,False,https://v.redd.it/wwe711qaqoh61,PETS AND PLANTS,592
n80otu,houseplants,"She might not be r/nextfuckinevel material, but after a year of hard work, i think she’s pretty sky high.",0.97,34915,<praw.models.comment_forest.CommentForest object at 0x7f9516e0bca0>,False,https://i.redd.it/nynzxsss8zx61.jpg,HIGHLIGHT,551
md37n7,houseplants,Sounds about right!,0.95,33155,<praw.models.comment_forest.CommentForest object at 0x7f94fd12a170>,False,https://i.imgur.com/abUkjM3.jpg,HUMOR/FLUFF,323
r2ckp6,houseplants,"Saw this on tiktok, how clever is it",0.91,32890,<praw.models.comment_forest.CommentForest object at 0x7f954a299570>,False,https://v.redd.it/4qzxa1udou181,HUMOR/FLUFF,684
11v2cds,houseplants,I made this backgammon set with pressed and preserved ferns and Veronica flowers,0.96,29738,<praw.models.comment_forest.CommentForest object at 0x7f951731c070>,False,https://i.redd.it/pudvee0q3moa1.jpg,Stuff: SATURDAYS ONLY,313
6ez8ag,cscareerquestions,"Accidentally destroyed production database on first day of a job, and was told to leave, on top of this i was told by the CTO that they need to get legal involved, how screwed am i?",0.97,28558,<praw.models.comment_forest.CommentForest object at 0x7f954a367eb0>,1496530533.0,https://www.reddit.com/r/cscareerquestions/comments/6ez8ag/accidentally_destroyed_production_database_on/,,4204
idak31,houseplants,I bought my wife a Thai Constellation Monstera for her birthday. This was her reaction!,0.95,27745,<praw.models.comment_forest.CommentForest object at 0x7f954a36c2b0>,False,https://v.redd.it/o0hj3dlqv5i51,HUMOR/FLUFF,806
v2lpdw,cscareerquestions,Elon Musk just asked all employees to return to office when it’s physically impossible to do so,0.89,25874,<praw.models.comment_forest.CommentForest object at 0x7f951dad1ed0>,False,https://www.reddit.com/r/cscareerquestions/comments/v2lpdw/elon_musk_just_asked_all_employees_to_return_to/,,2735
fkb0sc,houseplants,PSA,0.97,25423,<praw.models.comment_forest.CommentForest object at 0x7f9517435450>,False,https://i.redd.it/fmdd75ig7an41.jpg,DISCUSSION,199
v8dcja,houseplants,Happy news: thought my monstera was dead for good after I had to evacuate Kyiv for months. But it didn't give up :),0.96,25303,<praw.models.comment_forest.CommentForest object at 0x7f9559c4dd20>,False,https://www.reddit.com/gallery/v8dcja,Before / After - Progress Pics,234
hbddd6,houseplants,"Teaching my little green thumb early! She watches me love on our plants daily and yesterday she said, Mommy I want my own plant. Took her straight to a nursery and now we have a new 🌸! Meet Daisy, my 5 year daughter’s first plant! ❤️🥰 She is so happy; I love watching her come to love plants too.",0.94,25145,<praw.models.comment_forest.CommentForest object at 0x7f9516ffbfd0>,False,https://i.redd.it/9d89iit6tn551.jpg,PLANT SELFIE,499
p8apr0,houseplants,just me and my Prince of Orange 🍊,0.96,24977,<praw.models.comment_forest.CommentForest object at 0x7f951db504f0>,False,https://i.redd.it/s4f6a8fj0ki71.jpg,PEOPLE: FRIDAYS ONLY,352
nsfbx7,houseplants,r/houseplants starter pack,0.97,24906,<praw.models.comment_forest.CommentForest object at 0x7f950dffd090>,False,https://i.redd.it/8jjgt90pbb371.jpg,HUMOR/FLUFF,510
y16ra4,houseplants,Years of work gone bc of an abusive partner. My favorite monstera cut… everything destroyed. I’m at a loss for words.,0.9,24549,<praw.models.comment_forest.CommentForest object at 0x7f954a3c8400>,False,https://www.reddit.com/gallery/y16ra4,DISCUSSION,1639
u85kr6,houseplants,Plant room at the center of my home.,0.98,23559,<praw.models.comment_forest.CommentForest object at 0x7f953a3c60b0>,False,https://i.redd.it/t2dkygo6tqu81.jpg,HIGHLIGHT,332
kb5a1r,houseplants,My First DIY Moss Pole,0.97,23261,<praw.models.comment_forest.CommentForest object at 0x7f951dcb58a0>,False,https://i.redd.it/vc9o12mbxk461.jpg,SELFIE,262
gw37tn,houseplants,We wanted to take a family pic,0.95,22579,<praw.models.comment_forest.CommentForest object at 0x7f950e108850>,False,https://i.redd.it/zvgxdjdmkr251.jpg,PLANT HOMES,407
fz3uif,houseplants,My office had a competition for best teleworking station... I won 😄🌿 (framed photo is of my boss 😂),0.96,21859,<praw.models.comment_forest.CommentForest object at 0x7f950e18d210>,False,https://i.redd.it/k1rvvmisj6s41.jpg,HUMOR/FLUFF,372
12burtv,houseplants,A humming bird decided to bless our Monstera,0.98,21733,<praw.models.comment_forest.CommentForest object at 0x7f950e27f040>,False,https://i.redd.it/bvn2k2vrtyra1.jpg,Highlight,257
upe9fi,houseplants,What kind of plant would you recommend for my window in my new appartment?,0.91,21694,<praw.models.comment_forest.CommentForest object at 0x7f94fcef4a90>,False,https://www.reddit.com/r/houseplants/comments/upe9fi/what_kind_of_plant_would_you_recommend_for_my/,HUMOR/FLUFF,1682
ng4bmk,houseplants,TODAY'S SATISFACTORY VIDEO!,0.96,20562,<praw.models.comment_forest.CommentForest object at 0x7f94fcf85bd0>,False,https://v.redd.it/caseziqsivz61,HIGHLIGHT,303
yjgefp,houseplants,A month ago I posted about my ex destroying my plants and had a larger response than i could ever imagine. But this week this leaf broke through the destroyed stems and sprouted & it’s almost poetic since he is gone now. Not to be absolutely cheesy but I mean cmon 😂 I love you all planty people.,0.95,20452,<praw.models.comment_forest.CommentForest object at 0x7f951751cee0>,False,https://i.redd.it/svrpma1bsdx91.jpg,DISCUSSION,311
kqzeiv,houseplants,Sorry Mom and Dad...,0.97,20241,<praw.models.comment_forest.CommentForest object at 0x7f94fd190fa0>,False,https://i.redd.it/jj7q34h8xi961.jpg,HUMOR/FLUFF,122
nv7zse,houseplants,"The Creation of Adam, Michelangelo, c. 1508-1512",0.98,19918,<praw.models.comment_forest.CommentForest object at 0x7f953a49e080>,False,https://i.redd.it/mz1a2e0ai2471.jpg,HUMOR/FLUFF,96
gymch8,houseplants,My uncle’s 35 year old Desert Candle Cactus (Euphorbia Acrurensis).,0.97,19911,<praw.models.comment_forest.CommentForest object at 0x7f953a4dba60>,False,https://i.redd.it/9loatnzmfk351.jpg,META,286
johhe1,houseplants,"I planted this last year and it’s getting long! A jug, spilling a string of pearls.",0.98,19672,<praw.models.comment_forest.CommentForest object at 0x7f953a51b760>,False,https://i.redd.it/45ift567uex51.jpg,ART,202
hoz3xh,houseplants,Which one of you deviants lives here?,0.98,19355,<praw.models.comment_forest.CommentForest object at 0x7f95175a5030>,False,https://i.imgur.com/PoSgcez.jpg,,247
pmzujw,houseplants,Wildly accurate meme,0.95,19200,<praw.models.comment_forest.CommentForest object at 0x7f9517610bb0>,False,https://i.redd.it/c8b1e40zn4n71.jpg,META,428
14e2mvn,jobs,I was told there is a shortage of trade workers and now I know why,0.94,18980,<praw.models.comment_forest.CommentForest object at 0x7f94fd2846d0>,1687279087.0,https://www.reddit.com/r/jobs/comments/14e2mvn/i_was_told_there_is_a_shortage_of_trade_workers/,Companies,2778
stfo17,houseplants,My white princess philodendron finally threw out a pink leaf,0.98,18941,<praw.models.comment_forest.CommentForest object at 0x7f951de5ab30>,False,https://www.reddit.com/gallery/stfo17,HIGHLIGHT,280
hd5y5r,houseplants,Found a String of Dolphins locally before I pulled the trigger on Etsy! It even has a few blooms!,0.96,18753,<praw.models.comment_forest.CommentForest object at 0x7f951e001f00>,False,https://i.imgur.com/YdRqkkz.jpg,SELFIE,227
o7r8w9,houseplants,"They say “plants are boring,” yet i have to create a hurricane for my fiddle leaf fig every week or it will literally commit suicide",0.97,18662,<praw.models.comment_forest.CommentForest object at 0x7f950e350820>,False,https://i.redd.it/mprox0gnvf771.gif,HUMOR/FLUFF,510
tl3px7,houseplants,"Two years of remote work and I come back to THIS! Any ideas on replanting, or do I leave it alone??",0.98,18377,<praw.models.comment_forest.CommentForest object at 0x7f953a59a830>,False,https://i.imgur.com/9zLTybX.jpg,HELP,758
is4yrw,houseplants,"By golly, I think I fit all my patio houseplants back into the house and I'm still scratching my head on how I managed it.",0.97,18118,<praw.models.comment_forest.CommentForest object at 0x7f94fd3cbee0>,False,https://i.redd.it/g1hbop40wym51.jpg,PLANT HOMES,337
m6h25o,houseplants,I see nothing wrong here.,0.98,18032,<praw.models.comment_forest.CommentForest object at 0x7f94fd3d00d0>,False,https://i.redd.it/qg5eivxuxfn61.jpg,HUMOR/FLUFF,188
hlwotz,houseplants,Look at this magnificent Dioon Edule! Dioon’s are among the oldest seed plants and even pre-date the dinosaurs!,0.98,17907,<praw.models.comment_forest.CommentForest object at 0x7f951e04e710>,False,https://i.imgur.com/PskhIVz.jpg,PLANT ID,194
ju4rhc,houseplants,"I had to bring my bathtub cactus planter (Mammillaria and monkeytail cacti) inside the office for the winter, and one of the legs started budding in a very inopportune place...",0.98,17846,<praw.models.comment_forest.CommentForest object at 0x7f951e0b9ba0>,False,https://i.redd.it/lrioezrsg8z51.jpg,HELP,200
l3fbkn,houseplants,My husband took my four year old daughter out this morning to pick some flower seeds for her first plant. She insisted on grass.,0.97,17680,<praw.models.comment_forest.CommentForest object at 0x7f94fd465810>,False,https://i.redd.it/qt788rdf04d61.jpg,HUMOR/FLUFF,301
s50gsq,houseplants,My Devil's Ivy (Golden Pothos) isn't far off turning onto its 4th wall in my living room and at that point I believe it will become the proud owner of this house..,0.97,17582,<praw.models.comment_forest.CommentForest object at 0x7f94fd4e15d0>,False,https://i.redd.it/5x3la5trhyb81.jpg,PETS AND PLANTS,480
nyi3f0,houseplants,I took some family photos today.,0.88,17553,<praw.models.comment_forest.CommentForest object at 0x7f951e169150>,False,https://www.reddit.com/gallery/nyi3f0,PEOPLE: FRIDAYS ONLY,414
hafqet,houseplants,Heard we were doing family portraits. Right now it's just Gladys and I.,0.92,17503,<praw.models.comment_forest.CommentForest object at 0x7f951e262fe0>,False,https://i.redd.it/ngy55koj0d551.jpg,,371
makuyo,houseplants,"I thought you guys would appreciate this, since none of my friends did. One year difference.",0.97,17488,<praw.models.comment_forest.CommentForest object at 0x7f9559d0feb0>,False,https://i.imgur.com/jFBdXKm.jpg,,332
r4dr8r,houseplants,i bought a house with a solarium recently,0.97,17211,<praw.models.comment_forest.CommentForest object at 0x7f9559d1c2b0>,False,https://i.redd.it/bogbf1dpde281.jpg,PLANT HOMES,271
p0dbsa,houseplants,"Well, the humidifier works…",0.98,16940,<praw.models.comment_forest.CommentForest object at 0x7f9559dd23b0>,False,https://i.redd.it/g4hrjqi5i4g71.jpg,HIGHLIGHT,365
12w2468,houseplants,Who's making these charts and why are they lying.,0.95,16857,<praw.models.comment_forest.CommentForest object at 0x7f94fd5cbd90>,False,https://i.redd.it/n7o0t7hd5nva1.jpg,Humor/Fluff,2104
kumqad,houseplants,Family member for over 50 years,0.98,16710,<praw.models.comment_forest.CommentForest object at 0x7f94fd6ad750>,False,https://i.redd.it/z20fqb0sika61.jpg,PLANT HOMES,253
usi8gq,houseplants,😂,0.96,16589,<praw.models.comment_forest.CommentForest object at 0x7f94fd92ad10>,False,https://i.imgur.com/M2p6n6Y.jpg,HUMOR/FLUFF,129
lhtpej,houseplants,I found a photo of her flowering! 75 y/o Christmas cactus.,0.98,16440,<praw.models.comment_forest.CommentForest object at 0x7f950e5135b0>,False,https://i.redd.it/f00eos94qwg61.jpg,HIGHLIGHT,181
x04bvb,houseplants,"It’s been nearly two years since I made this plant stand, and it’s probably still the best idea I’ve had in my entire life",0.97,16329,<praw.models.comment_forest.CommentForest object at 0x7f950e566020>,False,https://i.redd.it/3c583vqzdik91.jpg,HIGHLIGHT,234
l0qnad,houseplants,That’s always been there!,0.97,16321,<praw.models.comment_forest.CommentForest object at 0x7f9517798ee0>,False,https://v.redd.it/f06lvbkc7cc61,HUMOR/FLUFF,185
xlvodv,houseplants,I took a family photo!,0.93,16262,<praw.models.comment_forest.CommentForest object at 0x7f951781f3a0>,False,https://i.redd.it/jqx8ie9fmlp91.jpg,PEOPLE: FRIDAYS ONLY,261
hrxszp,houseplants,"Posted yesterday about my adult son with autism selling houseplants. These are today's pictures. First one is waiting for customers, second picture is ""shift change"" and the final picture is after he sold out. People were so kind today.",0.96,16262,<praw.models.comment_forest.CommentForest object at 0x7f950e5e6dd0>,False,https://i.redd.it/bf7ff80cm3b51.jpg,,302
pj8t14,houseplants,Plants getting settled into their new home.,0.97,16232,<praw.models.comment_forest.CommentForest object at 0x7f950e67b010>,False,https://i.redd.it/hz2zn9yc9yl71.jpg,FAMILY PHOTO,376
i0vddx,houseplants,I see your house plants and raise you a plant house,0.97,16079,<praw.models.comment_forest.CommentForest object at 0x7f95178bfb80>,False,https://i.redd.it/m94loja1j2e51.jpg,META,170
11qqo4v,houseplants,my heart 🥹 I go hope my string of pearls is comfy enough,0.97,15832,<praw.models.comment_forest.CommentForest object at 0x7f95178bfb50>,False,https://i.redd.it/l2u7dyez0nna1.jpg,Pets and Plants,198
gdldf6,houseplants,Look how large my Monstera leaf has grown!,0.97,15712,<praw.models.comment_forest.CommentForest object at 0x7f9517919870>,False,https://i.redd.it/axp9vyn9otw41.jpg,HUMOR/FLUFF,198
jncr5z,houseplants,"Same, honestly.",0.98,15565,<praw.models.comment_forest.CommentForest object at 0x7f951798de70>,False,https://i.redd.it/53jiftwqr1x51.jpg,HUMOR/FLUFF,104
11hlho2,houseplants,I wanted to add a “plant chandelier” to my bath. Zero regrets.,0.96,15442,<praw.models.comment_forest.CommentForest object at 0x7f9517a08760>,False,https://www.reddit.com/gallery/11hlho2,Plant Homes,289
gmmhqw,houseplants,i desperately want this fern,0.98,15413,<praw.models.comment_forest.CommentForest object at 0x7f94fcd9d210>,False,https://i.redd.it/v278k8vmfpz41.jpg,HUMOR/FLUFF,267
gwkuag,houseplants,So relatable.,0.96,15410,<praw.models.comment_forest.CommentForest object at 0x7f94fd7ccf40>,False,https://v.redd.it/6ppc2zuo7x251,,195
j3zm73,houseplants,Thought you guys would appreciate this pilea!,0.97,15305,<praw.models.comment_forest.CommentForest object at 0x7f953a6a9810>,False,https://i.redd.it/lpyr7kbo1qq51.jpg,ART,86
ppp1ly,houseplants,Update on my variegated dragon scale alocasia 🐉🌱 after 2 green leaves she blessed me with a fully white/cream leaf!,0.98,15295,<praw.models.comment_forest.CommentForest object at 0x7f953a74ff10>,False,https://i.redd.it/1xp4y7f2eyn71.jpg,HIGHLIGHT,269
142dgpf,jobs,PTO denied but I’m not coming into work anyway,0.95,15248,<praw.models.comment_forest.CommentForest object at 0x7f953a754310>,False,https://www.reddit.com/r/jobs/comments/142dgpf/pto_denied_but_im_not_coming_into_work_anyway/,Work/Life balance,2173
iv7cta,houseplants,Proud plant mom family photo. Though sometimes the sheer amount of plants i care for overwhelms me.,0.96,15181,<praw.models.comment_forest.CommentForest object at 0x7f951e389c30>,False,https://i.redd.it/idgvgjsr4xn51.jpg,FAMILY PHOTO,415
glpbvg,houseplants,"After 4 years, my orchid finally bloomed :)",0.92,15050,<praw.models.comment_forest.CommentForest object at 0x7f94fda52860>,False,https://i.redd.it/iqrrykebnez41.jpg,,327
p8p9w3,houseplants,I crocheted a Monstera blanket!,0.98,14857,<praw.models.comment_forest.CommentForest object at 0x7f9517b03df0>,False,https://www.reddit.com/gallery/p8p9w3,STUFF: SATURDAYS ONLY,238
s5hgfq,houseplants,"My hotel in Quito, Ecuador has truly outdone itself",0.98,14822,<praw.models.comment_forest.CommentForest object at 0x7f9517b083d0>,False,https://i.redd.it/r7s8t8dda3c81.jpg,HIGHLIGHT,139
12ooobs,houseplants,My dad mailed me cuttings and drew an arrow to show which way to plant 😆,0.97,14747,<praw.models.comment_forest.CommentForest object at 0x7f950e7e3220>,False,https://i.redd.it/n5hhbr1xpcua1.jpg,Humor/Fluff,160
z8cklq,houseplants,My 4’11” mom and her amazing dieffenbachia,0.97,14387,<praw.models.comment_forest.CommentForest object at 0x7f950e82ebc0>,False,https://i.redd.it/1pk4n1o2613a1.jpg,HIGHLIGHT,181
g7v85c,houseplants,My Mom painted some of my favorite plants!,0.98,14246,<praw.models.comment_forest.CommentForest object at 0x7f950e88b640>,False,https://i.redd.it/xcke6nvuezu41.jpg,PLANT HOMES,185
k6jh67,houseplants,My fiance asked me to take photos of her philodendron prince of orange blooming,0.97,14238,<praw.models.comment_forest.CommentForest object at 0x7f94fdb8df30>,False,https://imgur.com/oKYVtf0,ART,291
vjt6a7,houseplants,I thought you wonderful people might enjoy my newest tattoo!,0.95,14222,<praw.models.comment_forest.CommentForest object at 0x7f94fdbfc370>,False,https://i.redd.it/holc9p3kol791.jpg,PEOPLE: FRIDAYS ONLY,228
ldgq77,houseplants,It’s called a ✨coping mechanism✨,0.97,14212,<praw.models.comment_forest.CommentForest object at 0x7f94fdcb8250>,False,https://i.redd.it/p56ddy9d0qf61.jpg,FAMILY PHOTO,259
jl8yvx,houseplants,Thought y’all would find this funny. Vote everyone!🌿,0.95,14199,<praw.models.comment_forest.CommentForest object at 0x7f94fdd36470>,False,https://i.redd.it/fo84xpkbubw51.jpg,HUMOR/FLUFF,99
zbvphq,houseplants,Top tier foreplay,0.96,14195,<praw.models.comment_forest.CommentForest object at 0x7f951e4935e0>,False,https://i.redd.it/ut76ixagjt3a1.jpg,HUMOR/FLUFF,136
tijoa7,houseplants,so here's a glimpse of my living room in daytime,0.96,14049,<praw.models.comment_forest.CommentForest object at 0x7f9529b0e8c0>,False,https://v.redd.it/2wygq1k74jo81,PETS AND PLANTS,471
juzoce,houseplants,i just got home from an awful day at work to this on my door and i’m literally crying with joy.,0.97,13986,<praw.models.comment_forest.CommentForest object at 0x7f9517b8a0b0>,False,https://i.redd.it/tm3j509iuiz51.jpg,HUMOR/FLUFF,222
i3qfja,houseplants,My echeveria showing me some love with its blooms!,0.98,13929,<praw.models.comment_forest.CommentForest object at 0x7f9529848370>,False,https://imgur.com/gt0AJvk,HIGHLIGHT,156
rb6tdu,cscareerquestions,I just pushed my first commit to AWS!,0.94,13832,<praw.models.comment_forest.CommentForest object at 0x7f954a202710>,False,https://www.reddit.com/r/cscareerquestions/comments/rb6tdu/i_just_pushed_my_first_commit_to_aws/,New Grad,554
sw0kr8,houseplants,Pothos gone wild!,0.97,13806,<praw.models.comment_forest.CommentForest object at 0x7f951e56a710>,False,https://i.redd.it/qu8i7hg2opi81.jpg,HIGHLIGHT,428
zkzjdh,houseplants,Consequences of oversleeping with a 4yo in the house…,0.92,13747,<praw.models.comment_forest.CommentForest object at 0x7f94fddb7280>,False,https://i.redd.it/0igecpuzeq5a1.jpg,DISCUSSION,982
nn3rmc,houseplants,Started a new job and found one of us.,0.98,13730,<praw.models.comment_forest.CommentForest object at 0x7f950e94dae0>,False,https://i.redd.it/vb9pgkwkiw171.jpg,HUMOR/FLUFF,383
htngwp,houseplants,"My late mother’s dumbcanes. Nassau, bahamas.",0.98,13727,<praw.models.comment_forest.CommentForest object at 0x7f9517f054b0>,False,https://i.redd.it/vss7wj81dob51.jpg,HIGHLIGHT,187
ikjuhu,houseplants,I love walking out into my living room every morning to this! Always starting my day with positive vibes.,0.97,13672,<praw.models.comment_forest.CommentForest object at 0x7f950ea603a0>,False,https://i.redd.it/cjruls9jbjk51.jpg,HIGHLIGHT,201
ujayh4,houseplants,"My husband said , "" No !! "" ...",0.98,13605,<praw.models.comment_forest.CommentForest object at 0x7f950eabab30>,False,https://i.redd.it/aili651wyqx81.png,HIGHLIGHT,511
9u3fww,jobs,So real talk. Why are so may $30k to $40k per year jobs requiring a bachelors degree?,0.93,13567,<praw.models.comment_forest.CommentForest object at 0x7f9517c9ee60>,False,https://www.reddit.com/r/jobs/comments/9u3fww/so_real_talk_why_are_so_may_30k_to_40k_per_year/,,4161
phej6s,houseplants,The monstera at my parents’ house.,0.98,13532,<praw.models.comment_forest.CommentForest object at 0x7f950eb5da20>,False,https://i.redd.it/k1to588pycl71.jpg,HIGHLIGHT,161
ogheg1,houseplants,"I told her she could be anything, so she became a spinal column. Follow your anatomical leggy-plant dreams, little crassula!",0.98,13518,<praw.models.comment_forest.CommentForest object at 0x7f9559e12920>,False,https://i.redd.it/4glt8pyl82a71.jpg,HUMOR/FLUFF,138
xymy9d,houseplants,My yellow hibiscus surprisingly made a 50/50 pink & yellow flower. Looks stunning!,0.99,13370,<praw.models.comment_forest.CommentForest object at 0x7f9559e431c0>,False,https://i.imgur.com/IYoUupe.jpg,HIGHLIGHT,159
vdxze7,houseplants,Usually i hate 5 minute crafts…. BUT THIS??????? I dont hate this,0.94,13301,<praw.models.comment_forest.CommentForest object at 0x7f9559e854b0>,False,https://v.redd.it/yv7yt92f92691,HIGHLIGHT,283
me1phq,houseplants,I put some of my plants outside this week. One of my neighbors left the sweetest note. I love plant people!!!,0.97,13302,<praw.models.comment_forest.CommentForest object at 0x7f951e7dffa0>,False,https://www.reddit.com/gallery/me1phq,HIGHLIGHT,283
l9d0mx,houseplants,"I have come to realize that a lot of folks that love science/medicine also love houseplants, so I painted these for you:)",0.97,13219,<praw.models.comment_forest.CommentForest object at 0x7f951e7e4400>,False,https://i.redd.it/4fvha4caeoe61.jpg,ART,231
l438ub,houseplants,Couldn’t find the right size shelf for some of my plants so decided to try out my high school wood working skills and make one myself!,0.98,13188,<praw.models.comment_forest.CommentForest object at 0x7f950ec5b130>,False,https://www.reddit.com/gallery/l438ub,PLANT HOMES,194
nbvtjd,houseplants,Bought my grandmother a grocery store orchid 3 years ago for Mother’s Day. It currently has 45 blooms.,0.98,13197,<praw.models.comment_forest.CommentForest object at 0x7f950ece1d80>,False,https://i.imgur.com/VhhFFFL.jpg,HIGHLIGHT,243
wwms7x,houseplants,This is your reminder to take your birth control.,0.93,13121,<praw.models.comment_forest.CommentForest object at 0x7f951e889600>,False,https://i.redd.it/5h6ibp1vloj91.jpg,HELP,429
p6rx1i,houseplants,Opening a plant shop this weekend!,0.97,13127,<praw.models.comment_forest.CommentForest object at 0x7f951e91cee0>,False,https://www.reddit.com/gallery/p6rx1i,PLANT HOMES,242
mzc0tu,houseplants,It’s obvious they needed some hats.,0.98,13102,<praw.models.comment_forest.CommentForest object at 0x7f94e858bf70>,False,https://i.redd.it/ma5of2quzlv61.jpg,HUMOR/FLUFF,158
wtzmp4,houseplants,The monstera where I used to work,0.98,12996,<praw.models.comment_forest.CommentForest object at 0x7f94e8594400>,False,https://i.imgur.com/QJtCiOB.jpg,PLANT HOMES,123
ur9li9,houseplants,"Excited to be almost finished with my cacti shelves, just need to add trim.",0.98,12969,<praw.models.comment_forest.CommentForest object at 0x7f951eaa0c40>,False,https://i.redd.it/26as54r9fxz81.jpg,PLANT HOMES,561
jz4c6c,houseplants,My GF scored this very subtle 30yr old philodendron for $95. Figured it would get the love it deserves here,0.98,12916,<praw.models.comment_forest.CommentForest object at 0x7f951eaeae60>,False,https://www.reddit.com/gallery/jz4c6c,PLANT HOMES,167
m54ewx,houseplants,the most demanding plant i own,0.96,12883,<praw.models.comment_forest.CommentForest object at 0x7f94e80f4b20>,False,https://v.redd.it/rqq0ytgt72n61,PETS AND PLANTS,188
qce0rp,houseplants,Am I doing it right?,0.97,12816,<praw.models.comment_forest.CommentForest object at 0x7f951eb79fc0>,False,https://i.imgur.com/UYl8LZn.jpeg,HUMOR/FLUFF,112
n4yc8r,houseplants,I literally jumped up and down shouting at my boyfriend to get my phone when I saw my huernia zebrina had bloomed,0.98,12752,<praw.models.comment_forest.CommentForest object at 0x7f951ebf56f0>,False,https://i.imgur.com/2SLhVHU.jpg,HIGHLIGHT,320
o5jbg7,houseplants,There’s always room for one more... plant 🌱,0.98,12741,<praw.models.comment_forest.CommentForest object at 0x7f951ecf7eb0>,False,https://i.redd.it/9erdc88xhs671.jpg,HUMOR/FLUFF,79
uot8fd,houseplants,"I’m waiting on a planter for my walking snake plant. Until then, side car it is!",0.98,12726,<praw.models.comment_forest.CommentForest object at 0x7f951ecfc370>,False,https://i.redd.it/1sf8996099z81.jpg,HIGHLIGHT,195
hdt7gs,houseplants,"I'm a little insecure about this picture of myself, but I really wanted to do a family photo and show you my baby's. Bf and I just moved in together 2 months ago, so the collection is still a little small!",0.93,12621,<praw.models.comment_forest.CommentForest object at 0x7f951ed22200>,False,https://i.redd.it/qelu86do0h651.jpg,,475
go98ue,houseplants,honestly I’m surprised I haven’t been bashed on here for all the questions I’ve asked lol,0.98,12542,<praw.models.comment_forest.CommentForest object at 0x7f94e8169ed0>,False,https://i.redd.it/0mhowrgjr7051.jpg,HUMOR/FLUFF,330
jbv3if,houseplants,So easy to tell which apartment frequents this sub.,0.98,12461,<praw.models.comment_forest.CommentForest object at 0x7f94e829c7c0>,False,https://i.redd.it/vfyldbrbebt51.jpg,HUMOR/FLUFF,137
