ID,Subreddit,Title,Upvote,Score,Comments,Edited,URL,Flair Text,Nums of Comment
uz8ab8,houseplants,I keep a little pikachu in my monstera’s pot and I just noticed this (camouflaged!) mushroom today! 😭,0.98,7711,<praw.models.comment_forest.CommentForest object at 0x7f94ffd52500>,False,https://i.redd.it/rehi17hk63291.jpg,HUMOR/FLUFF,236
nb4fiz,houseplants,My moms jade has been in the same pot for 20 years,0.98,7700,<praw.models.comment_forest.CommentForest object at 0x7f94ffd9bc70>,False,https://v.redd.it/qhkh9nvadsy61,HIGHLIGHT,152
nl0c0d,houseplants,It took about a week and half for this leaf to unfold itself. I’m so proud of him.,0.99,7700,<praw.models.comment_forest.CommentForest object at 0x7f94ffe3a260>,False,https://i.redd.it/q60epn1m2c171.jpg,HIGHLIGHT,100
m7cgyl,houseplants,Just moved in and the property came with these 2 bad boys,0.99,7691,<praw.models.comment_forest.CommentForest object at 0x7f94ffe92380>,False,https://i.redd.it/y24lds3yznn61.jpg,ART,112
11qign0,houseplants,Check out my propagation station!,0.98,7690,<praw.models.comment_forest.CommentForest object at 0x7f94d9dac460>,False,https://i.redd.it/p5ridr8ljlna1.jpg,Humor/Fluff,121
1108zxj,cscareerquestions,"I accidentally came across my senior engineer on an online video game, now he’s being distant at work.",0.94,7688,<praw.models.comment_forest.CommentForest object at 0x7f94d9daf4c0>,1676241987.0,https://www.reddit.com/r/cscareerquestions/comments/1108zxj/i_accidentally_came_across_my_senior_engineer_on/,Experienced,978
qptq76,houseplants,*angry laughing crying emoji*,0.99,7684,<praw.models.comment_forest.CommentForest object at 0x7f94d9de4d30>,False,https://i.redd.it/v7kscwvrehy71.jpg,HUMOR/FLUFF,148
hfwrce,houseplants,"My grandma loved orchids and put us in charge of taking care of hers when she moved last year. She got sick and recently passed away. Looking back, we are almost positive she had COVID. Her orchid was barely hanging on, and the day she died we saw a stem with buds. Today, it bloomed. Hi gram. 💕",0.96,7684,<praw.models.comment_forest.CommentForest object at 0x7f955a51e380>,False,https://i.redd.it/agz7e5ji65751.jpg,HIGHLIGHT,74
nnyafs,houseplants,Wanted to show off my African Violet 💜,0.99,7677,<praw.models.comment_forest.CommentForest object at 0x7f955a57ff10>,False,https://i.redd.it/753v2pbn35271.jpg,HIGHLIGHT,98
sbparf,houseplants,"My Dad planted this Birds of Paradise when I was born, and after 27 years it’s finally bloomed :)",0.99,7670,<praw.models.comment_forest.CommentForest object at 0x7f955a584220>,False,https://www.reddit.com/gallery/sbparf,HIGHLIGHT,89
ja6mpb,houseplants,Gifted my new neighbors a plant to welcome them to the building and found this on our door today :),0.99,7674,<praw.models.comment_forest.CommentForest object at 0x7f955a5c4280>,False,https://i.redd.it/0sextlvtiss51.jpg,HIGHLIGHT,112
11sr2hy,houseplants,Thought y’all would appreciate this,0.96,7670,<praw.models.comment_forest.CommentForest object at 0x7f955a5f74f0>,False,https://i.redd.it/lp2diuhnl4oa1.jpg,Humor/Fluff,130
ezck9t,houseplants,I cackled,0.97,7662,<praw.models.comment_forest.CommentForest object at 0x7f94d9eb8490>,False,https://i.redd.it/2kh9z379z4f41.jpg,HUMOR/FLUFF,90
mtzz3n,houseplants,This guy is two years old now!,0.99,7659,<praw.models.comment_forest.CommentForest object at 0x7f94d9efb0a0>,False,https://www.reddit.com/gallery/mtzz3n,HIGHLIGHT,190
jm339e,houseplants,And the subreddit of the year award goes to...,0.98,7638,<praw.models.comment_forest.CommentForest object at 0x7f94d9f32470>,False,https://i.redd.it/13rpxjgz1nw51.jpg,HUMOR/FLUFF,188
ibj58c,houseplants,I’m in love with my new plant + pot combo (but I can’t post it on my other social media as my partner hasn’t yet realised I snuck in another plant!),0.98,7634,<praw.models.comment_forest.CommentForest object at 0x7f94c91e1450>,False,https://i.redd.it/o4achj05qlh51.jpg,HIGHLIGHT,148
10euhex,houseplants,"Mom posts in FB group selling her most prized plant for baby formula, gets showered in kindness instead",0.96,7634,<praw.models.comment_forest.CommentForest object at 0x7f94c9258e20>,False,https://www.reddit.com/gallery/10euhex,HUMOR/FLUFF,356
fvjo40,houseplants,Just DRY OUT ALREADY!!!,0.99,7629,<praw.models.comment_forest.CommentForest object at 0x7f94ffecc6d0>,False,https://i.redd.it/upi2vtblw1r41.jpg,HUMOR/FLUFF,82
10n0ljz,houseplants,Hold your breath.... 3 2 1 ..... 😲😲😲,0.95,7614,<praw.models.comment_forest.CommentForest object at 0x7f955a6050c0>,False,https://v.redd.it/61ee9qpveoea1,Plant Homes,271
juhmoo,houseplants,Are you about that vibe?,0.99,7611,<praw.models.comment_forest.CommentForest object at 0x7f955a613790>,False,https://i.redd.it/l8dkq5rjncz51.jpg,PLANT HOMES,195
mcl84t,houseplants,This is my corner. On a rainy night.,0.98,7600,<praw.models.comment_forest.CommentForest object at 0x7f955a6c19f0>,False,https://i.redd.it/wngeqrdrj2p61.jpg,PETS AND PLANTS,160
uuns4n,houseplants,"I embroidered a houseplant hoop, this time featuring my kitty!",0.98,7583,<praw.models.comment_forest.CommentForest object at 0x7f94eabe5bd0>,False,https://i.redd.it/orv9ps9t5u091.jpg,STUFF: SATURDAYS ONLY,73
l6l3pb,houseplants,It’s a hard kombucha and jungle bath kind of a night.,0.98,7588,<praw.models.comment_forest.CommentForest object at 0x7f94eac36d70>,False,https://i.imgur.com/voXgIqX.jpg,HIGHLIGHT,141
s9a514,houseplants,DMX Challenge: Plant Edition 🪴🤞🏾,0.96,7570,<praw.models.comment_forest.CommentForest object at 0x7f94c92a7fd0>,False,https://v.redd.it/ya9yk17mg1d81,PEOPLE: FRIDAYS ONLY,250
i23au2,houseplants,Husband said you guys might like this?,0.97,7576,<praw.models.comment_forest.CommentForest object at 0x7f94c92ac040>,False,https://i.redd.it/hqk9d0melhe51.jpg,,72
jify79,houseplants,Built a tiny house for my monstera...,0.98,7563,<praw.models.comment_forest.CommentForest object at 0x7f94c9364b20>,False,https://i.redd.it/d0bkpma6dgv51.jpg,ART,81
xgsm4i,houseplants,Facts 🪴🪴🪴,0.98,7559,<praw.models.comment_forest.CommentForest object at 0x7f94c937e980>,False,https://i.redd.it/6rwvw2154co91.jpg,HUMOR/FLUFF,83
13i6h98,houseplants,My job had this mediocre plant display by the entrance. I convinced my boss to let me add more color,0.97,7539,<praw.models.comment_forest.CommentForest object at 0x7f94eace7b50>,False,https://i.imgur.com/gCyB9DN.jpg,Highlight,99
jc9jic,houseplants,Dracaena Milky Way,0.98,7541,<praw.models.comment_forest.CommentForest object at 0x7f94ead23fd0>,False,https://i.redd.it/wgt4o4d4igt51.jpg,HIGHLIGHT,116
jo9pdq,houseplants,The snow made my plant corner extra cozy 💕,0.98,7535,<praw.models.comment_forest.CommentForest object at 0x7f94ead28160>,False,https://i.redd.it/5jv3g8czsbx51.jpg,PLANT HOMES,72
kmm8cm,houseplants,"Finally finished my dream plant shelves! My plan is to add grow lights, would love some recommendations on what kind you think would be the best for this setup!",0.99,7526,<praw.models.comment_forest.CommentForest object at 0x7f94ead753f0>,False,https://www.reddit.com/gallery/kmm8cm,PLANT HOMES,249
wms8xp,houseplants,I have to share my excitement! My offer was accepted for a house that my plants could grow in 🥰,0.97,7518,<praw.models.comment_forest.CommentForest object at 0x7f94ead9b640>,False,https://www.reddit.com/gallery/wms8xp,PLANT HOMES,173
hkbmqy,houseplants,I was told my recent embroidery may be appreciated here 😊 If only I actually had this many plants to surround myself with IRL!,0.99,7515,<praw.models.comment_forest.CommentForest object at 0x7f94eae3fca0>,False,https://i.redd.it/f6hfllu3nj851.jpg,ART,63
o8qgyw,houseplants,i made this stained glass monstera for my art class!! 🌱✨,0.99,7513,<praw.models.comment_forest.CommentForest object at 0x7f94eae9dea0>,False,https://www.reddit.com/gallery/o8qgyw,STUFF: SATURDAYS ONLY,77
ru1au0,houseplants,Am I the only one that agrees,0.96,7518,<praw.models.comment_forest.CommentForest object at 0x7f94eaec3010>,False,https://www.reddit.com/gallery/ru1au0,PLANT ID,532
sh1cfl,houseplants,Found on IG and had to share,0.97,7507,<praw.models.comment_forest.CommentForest object at 0x7f94eaeecf70>,False,https://i.redd.it/70d10mo501f81.jpg,HUMOR/FLUFF,41
kg2tb8,houseplants,Love seeing this every morning,0.99,7504,<praw.models.comment_forest.CommentForest object at 0x7f94b80b7df0>,False,https://i.redd.it/1edo0tqf83661.jpg,PLANT HOMES,64
ovqzee,houseplants,The morning sun in my bedroom 🌱🌞🌱,0.98,7503,<praw.models.comment_forest.CommentForest object at 0x7f94b80c0100>,False,https://i.redd.it/fp2wpwn9mqe71.jpg,PLANT HOMES,201
wuqd78,houseplants,Plant's movement after they get water,0.98,7498,<praw.models.comment_forest.CommentForest object at 0x7f94b80d50c0>,False,https://v.redd.it/3x7saf54w8j91,META,126
i8yjim,houseplants,Relatable,0.99,7505,<praw.models.comment_forest.CommentForest object at 0x7f94c958fe20>,False,https://i.redd.it/xf6bjxe0erg51.jpg,HUMOR/FLUFF,139
g8h2xk,houseplants,"You all really seemed to enjoy the disco ball planter I made, so I thought might as well share the iridescent terrarium I made",0.99,7494,<praw.models.comment_forest.CommentForest object at 0x7f94c95942e0>,False,https://i.redd.it/9dr8aer7t6v41.jpg,PLANT HOMES,136
hopbq0,houseplants,"Friday’s are for family: coleus, heartleaf philodendron, begonia rex, & some sort of bamboo tree. 🌱💕",0.97,7489,<praw.models.comment_forest.CommentForest object at 0x7f94c95e37c0>,False,https://i.redd.it/g0pq06v7c1a51.jpg,PLANT HOMES,161
nw43vw,houseplants,"Guys, I just got a major wishlist plant! Celebrate my Tricolor with me 🥳",0.99,7489,<praw.models.comment_forest.CommentForest object at 0x7f94d94a0f70>,False,https://i.redd.it/ha0wv6j6ka471.jpg,HAUL,273
hj9gwe,houseplants,He just looks so good next to that wall. 😍,0.98,7484,<praw.models.comment_forest.CommentForest object at 0x7f94b8159270>,False,https://i.redd.it/jrm3r03mr8851.jpg,PLANT HOMES,109
ov3z8f,houseplants,My voodoo lily fully unfurled!,0.99,7476,<praw.models.comment_forest.CommentForest object at 0x7f953aeab430>,False,https://i.redd.it/g4pygeaelie71.jpg,HIGHLIGHT,95
i2ch55,houseplants,I painted my terrible cat on my Pothos pot,0.98,7458,<praw.models.comment_forest.CommentForest object at 0x7f953af0fe20>,False,https://i.redd.it/smlewgl4ile51.jpg,ART,79
re3m7h,houseplants,Just bought a Birds of Paradise. Hope I don’t kill it.,0.95,7460,<praw.models.comment_forest.CommentForest object at 0x7f953af141f0>,False,https://i.redd.it/xbw16bxb0y481.jpg,HUMOR/FLUFF,125
gsqjvw,houseplants,Im a houseplant addict and im addicted to painting them 😆😆😆,0.97,7455,<praw.models.comment_forest.CommentForest object at 0x7f953af46950>,False,https://i.redd.it/vjkpzem0no151.jpg,ART,244
ynsk15,houseplants,My grandmothers prayer plant is unfairly glorious,0.99,7453,<praw.models.comment_forest.CommentForest object at 0x7f94b8214640>,False,https://i.redd.it/0rpmyhebkcy91.jpg,HIGHLIGHT,177
ryaiqt,houseplants,To my 21st Birthday my Grandma gave me the cactus she bought 48 years ago. His name is Albus. She never repotted him.,0.98,7449,<praw.models.comment_forest.CommentForest object at 0x7f94b82c90c0>,False,https://i.redd.it/euaw13lbfaa81.jpg,PEOPLE: FRIDAYS ONLY,126
n8p8sf,jobs,We need more people like this,0.98,7452,<praw.models.comment_forest.CommentForest object at 0x7f94b83238e0>,False,https://i.redd.it/fl8v3grw76y61.jpg,Job searching,288
gqkhdz,houseplants,"One does not simply stop buying plants—so when you start running out of space, you improvise.",0.93,7433,<praw.models.comment_forest.CommentForest object at 0x7f94b8371780>,False,https://i.redd.it/xw3pzqw2jz051.jpg,PLANT HOMES,163
fr8dro,houseplants,Just under 18 months progress - houseplant addiction is real!,0.98,7435,<praw.models.comment_forest.CommentForest object at 0x7f955a7179a0>,False,https://i.redd.it/a0aqlvk20np41.jpg,PLANT HOMES,149
icobok,houseplants,My camera shifted twice but I do love how this turned out.,0.97,7433,<praw.models.comment_forest.CommentForest object at 0x7f955a768df0>,False,https://v.redd.it/8im0a6xgvyh51,PLANT HOMES,151
ntajxu,houseplants,Seen at my local nursery. My non-plant friends didn’t appreciate the humour.,0.98,7425,<praw.models.comment_forest.CommentForest object at 0x7f955a7c0e50>,False,https://i.redd.it/3x799e6xtj371.jpg,HUMOR/FLUFF,69
mrk969,houseplants,My house is only 2 blocks away.. I need an intervention.,0.97,7423,<praw.models.comment_forest.CommentForest object at 0x7f94d9f8d4b0>,False,https://i.redd.it/71te983nmdt61.jpg,HUMOR/FLUFF,178
v5czwg,houseplants,My cactus is blooming! Had it for 3 years and this is the first time it’s ever done this 🌸🌸🌸,0.99,7394,<praw.models.comment_forest.CommentForest object at 0x7f94d9faf3d0>,False,https://i.redd.it/q6jhhx7hxs391.jpg,HIGHLIGHT,77
id1tug,cscareerquestions,Why did I spend 4 year getting a CS degree for Web Development when people doing coding bootcamp for a few weeks and are able to get same jobs?,0.94,7393,<praw.models.comment_forest.CommentForest object at 0x7f94da035870>,False,https://www.reddit.com/r/cscareerquestions/comments/id1tug/why_did_i_spend_4_year_getting_a_cs_degree_for/,,1681
ke6d48,houseplants,My gamer jungle,0.98,7391,<praw.models.comment_forest.CommentForest object at 0x7f94da05add0>,False,https://www.reddit.com/gallery/ke6d48,PLANT HOMES,227
jrqmm1,houseplants,Where do I sign?,0.99,7384,<praw.models.comment_forest.CommentForest object at 0x7f94c97caf50>,False,https://i.redd.it/p2uwze42jgy51.jpg,HUMOR/FLUFF,88
zgduds,houseplants,My daughter sent me this for my birthday 🥳 Aglaonema tripictum tricolor !!!,0.98,7394,<praw.models.comment_forest.CommentForest object at 0x7f94c982dc30>,False,https://i.redd.it/3zx0e2dqjs4a1.jpg,HAUL,164
gug87z,houseplants,My girlfriend wanted a plant and I didn’t want a plant. So we compromised and got like 50 plants,0.98,7383,<praw.models.comment_forest.CommentForest object at 0x7f94c9855450>,False,https://i.redd.it/7v5tyfb569251.jpg,PLANT HOMES,187
z53fav,houseplants,some of my houseplants🪴,0.98,7381,<praw.models.comment_forest.CommentForest object at 0x7f94c98ae9e0>,False,https://www.reddit.com/gallery/z53fav,STUFF: SATURDAYS ONLY,138
mdmplu,houseplants,So proud of my babies that I had to take a picture with all of them🥰,0.97,7358,<praw.models.comment_forest.CommentForest object at 0x7f94b84358d0>,False,https://i.redd.it/3hk86tdq0dp61.jpg,FAMILY PHOTO,221
qeykgf,houseplants,"Not to be dramatic, but how cool is this leaf! Texture and colors are crazy.",0.99,7358,<praw.models.comment_forest.CommentForest object at 0x7f94b8485390>,False,https://i.redd.it/bh9yzdrl3gv71.jpg,HIGHLIGHT,129
j6pvyc,houseplants,"Hi, r/houseplants!",0.98,7351,<praw.models.comment_forest.CommentForest object at 0x7f94c991b460>,False,https://i.redd.it/aig8rx511or51.jpg,PLANT HOMES,115
na7hhg,houseplants,i’m transgender and when i started to medically transition i bought my first plant (a schefflera) with the intention that we’d both slowly grow and change together. 7.5 months later and i’m proud to say that we’re both thriving 💕🏳️‍⚧️,0.83,7352,<praw.models.comment_forest.CommentForest object at 0x7f94c9966500>,False,https://i.redd.it/uvzto5si1ky61.jpg,HIGHLIGHT,354
hwpmwx,houseplants,My orchid is... very excited.,0.97,7335,<praw.models.comment_forest.CommentForest object at 0x7f94b857fbb0>,False,https://i.redd.it/p70qv5teooc51.jpg,HUMOR/FLUFF,139
l8cq8a,houseplants,Yeah GameStop is crazy and all but peep my local nursery in SF.,0.97,7331,<praw.models.comment_forest.CommentForest object at 0x7f94b8584040>,False,https://i.redd.it/an2hw5983ee61.jpg,FAMILY PHOTO,87
n71cv8,houseplants,My big Dioon edule!,0.97,7328,<praw.models.comment_forest.CommentForest object at 0x7f94b85f2140>,False,https://i.redd.it/5qz67gmuwpx61.jpg,PEOPLE: FRIDAYS ONLY,171
n0hxnh,houseplants,"My brother died seven years ago today. I kept one of the planters from his funeral, and it's still going strong today.",0.98,7320,<praw.models.comment_forest.CommentForest object at 0x7f94b85f2200>,False,https://i.imgur.com/zTHAQ0P.jpg,HIGHLIGHT,99
k795q3,houseplants,"Got fired yesterday. Got the jazz playing softly, watching the rain fall down. It’s all good.",0.98,7326,<praw.models.comment_forest.CommentForest object at 0x7f94c9a5c250>,False,https://i.redd.it/fs0bjmlrxd361.jpg,FAMILY PHOTO,143
zoy5pa,houseplants,The top post of this subreddit at the moment (embroidered monstera patch) is AI generated. Don't believe your eyes!,0.97,7302,<praw.models.comment_forest.CommentForest object at 0x7f94c9a9c760>,False,https://www.reddit.com/r/houseplants/comments/zoy5pa/the_top_post_of_this_subreddit_at_the_moment/,META,433
oc9mn9,houseplants,Went on a shopping spree for my Cake Day!,0.94,7303,<praw.models.comment_forest.CommentForest object at 0x7f94c9af7940>,False,https://i.redd.it/18wt1lncss871.jpg,FAMILY PHOTO,168
mucb4r,houseplants,it is OPEN! My White bird of paradise reaching the sky,0.99,7305,<praw.models.comment_forest.CommentForest object at 0x7f955a80e2f0>,False,https://www.reddit.com/gallery/mucb4r,PLANT HOMES,97
kt741a,houseplants,What is this growing on my Monstera's leaf?,0.98,7280,<praw.models.comment_forest.CommentForest object at 0x7f955a85b640>,False,https://i.redd.it/wkrkt5yz75a61.jpg,PETS AND PLANTS,152
11u0qud,houseplants,Relatable! (not OC),0.98,7274,<praw.models.comment_forest.CommentForest object at 0x7f955a88ffa0>,False,https://i.redd.it/p4icetkg4eoa1.jpg,Humor/Fluff,46
o3fxc4,houseplants,A surprise from my White Princess,0.99,7264,<praw.models.comment_forest.CommentForest object at 0x7f94eb2b0c70>,False,https://i.redd.it/wico1dug38671.jpg,HIGHLIGHT,72
pf5hgp,houseplants,"All houseplants and tropical plants at my local lowes (henderson, ky) are 50% off. I dont know who else to tell.",0.99,7253,<praw.models.comment_forest.CommentForest object at 0x7f94eb2c4550>,False,https://i.redd.it/99gisyq30pk71.jpg,PLANT HOMES,189
in2pbi,houseplants,My (little bit older than) 1 year old prayer plant!,0.99,7252,<praw.models.comment_forest.CommentForest object at 0x7f94eb2f64a0>,False,https://i.redd.it/1l3o62vrhcl51.jpg,HIGHLIGHT,214
nzdp3i,houseplants,My Pride Month planter ❤️🧡💛💚💙💜,0.93,7226,<praw.models.comment_forest.CommentForest object at 0x7f94eb376200>,False,https://i.redd.it/k808evajj5571.jpg,HIGHLIGHT,68
wbgl7w,houseplants,I would like to disagree,0.97,7230,<praw.models.comment_forest.CommentForest object at 0x7f94eb3f7d60>,False,https://i.redd.it/xs37v6ryuke91.jpg,HUMOR/FLUFF,853
x1pbrq,houseplants,"I used to kill every plant I touched, this is my home now!",0.98,7226,<praw.models.comment_forest.CommentForest object at 0x7f94eb41d6f0>,False,https://www.reddit.com/gallery/x1pbrq,PLANT HOMES,274
vkv1wv,houseplants,These is my favorite begonias,0.99,7226,<praw.models.comment_forest.CommentForest object at 0x7f94b8981810>,False,https://i.redd.it/lvwikz0psv791.png,HIGHLIGHT,70
uywy6d,houseplants,Family photo 💜 (save for an additional like 70 plants),0.95,7225,<praw.models.comment_forest.CommentForest object at 0x7f94eb5140d0>,False,https://i.redd.it/giq479w4g0291.jpg,PEOPLE: FRIDAYS ONLY,175
m4eymd,houseplants,I finally figured out a spot for my oldest pothos!,0.99,7213,<praw.models.comment_forest.CommentForest object at 0x7f94eb529c30>,False,https://i.redd.it/fd52ccolxum61.jpg,PLANT HOMES,180
smgprl,houseplants,So this happened last night.,0.99,7207,<praw.models.comment_forest.CommentForest object at 0x7f94eb59c0a0>,False,https://imgur.com/peqPatX.jpg,HIGHLIGHT,76
jdcv51,houseplants,I love it when a plan comes together.,0.98,7199,<praw.models.comment_forest.CommentForest object at 0x7f94da0c6a70>,False,https://i.redd.it/mjgnl2isftt51.jpg,HIGHLIGHT,62
jg60is,houseplants,I thought you guys would like my barn sale score!,0.99,7188,<praw.models.comment_forest.CommentForest object at 0x7f94da0f4610>,False,https://i.redd.it/x58c4b1g1pu51.jpg,ART,91
o2of9f,houseplants,Happy Pride month houseplant hoes!!!! 💕🌿🌈🥰,0.89,7183,<praw.models.comment_forest.CommentForest object at 0x7f94da1195d0>,False,https://i.redd.it/l6zpfi32u0671.jpg,FAMILY PHOTO,191
impf8a,houseplants,I’ve been trying to post this selfie with my first bulb grown caladuim since July but because of the state of the world I can’t remember when it’s Friday,0.93,7168,<praw.models.comment_forest.CommentForest object at 0x7f94da1492d0>,False,https://i.redd.it/p1zja5pjf7l51.jpg,SELFIE,127
wk1keh,houseplants,My home office plant wall,0.98,7167,<praw.models.comment_forest.CommentForest object at 0x7f94c9b64af0>,False,https://i.redd.it/1ecrkcmhhog91.jpg,PLANT HOMES,219
kgep39,houseplants,My first Bird of Paradise is just a little bigger than expected...,0.99,7169,<praw.models.comment_forest.CommentForest object at 0x7f94c9b9df00>,False,https://i.redd.it/w5a6xt1w57661.jpg,HAUL,170
fn1vmb,houseplants,I haven't stopped thinking of this home office for the past 10 years,0.98,7163,<praw.models.comment_forest.CommentForest object at 0x7f94da1a4130>,False,https://i.redd.it/rwt3mfv6y8o41.jpg,PLANT HOMES,87
im9g32,houseplants,just give me your $10 already,0.98,7150,<praw.models.comment_forest.CommentForest object at 0x7f94da1fdd50>,False,https://i.redd.it/z5w2dpv172l51.jpg,HUMOR/FLUFF,56
kanfoo,houseplants,Bathroom remodel complete,0.98,7149,<praw.models.comment_forest.CommentForest object at 0x7f94da22d390>,False,https://v.redd.it/std5lje96f461,PLANT HOMES,194
mxrkvs,houseplants,"I got a new shelf and rearranged my coping mechanisms... er, I mean my plants.",0.99,7144,<praw.models.comment_forest.CommentForest object at 0x7f94da24d5d0>,False,https://i.redd.it/7zrn40p8f6v61.jpg,FAMILY PHOTO,185
iuloqo,houseplants,"i've been desperate for some calathea earrings but couldn't find any, so i tried making some myself! not perfect but it's something",0.98,7140,<praw.models.comment_forest.CommentForest object at 0x7f94c9c611b0>,False,https://i.redd.it/o9la82kw7qn51.jpg,ART,118
pwwpt5,houseplants,Found a vintage ladder in my garage and thought this was the best way to display it 🤩,0.98,7141,<praw.models.comment_forest.CommentForest object at 0x7f94c9cd0040>,False,https://i.redd.it/osi0hvx7p5q71.jpg,PLANT HOMES,162
p4z0ye,houseplants,About 8 months ago our 10 year old banana plant suddenly started growing bananas. They just turned yellow and I tasted one. It’s the sweetest banana I ever tasted!,0.99,7135,<praw.models.comment_forest.CommentForest object at 0x7f94c96153c0>,False,https://www.reddit.com/gallery/p4z0ye,HIGHLIGHT,193
138kfe0,jobs,I love my 9-5 office job,0.94,7126,<praw.models.comment_forest.CommentForest object at 0x7f94b8685f90>,False,https://www.reddit.com/r/jobs/comments/138kfe0/i_love_my_95_office_job/,Work/Life balance,706
j8wot6,houseplants,I painted some pots for my succulents! What do you think? Any tips for the next batch?,0.98,7128,<praw.models.comment_forest.CommentForest object at 0x7f954a8b9c60>,False,https://www.reddit.com/gallery/j8wot6,ART,164
mivvjh,houseplants,Everyone in r/houseplants during the pandemic,0.98,7120,<praw.models.comment_forest.CommentForest object at 0x7f954a9e0820>,False,https://i.redd.it/9usauvktbuq61.jpg,HUMOR/FLUFF,61
oin4j4,houseplants,My absolute pride and joy,0.99,7122,<praw.models.comment_forest.CommentForest object at 0x7f954aa2d5d0>,False,https://www.reddit.com/gallery/oin4j4,HIGHLIGHT,165
lahmgf,houseplants,I am very happy! My mom made these stickers for me!! Best mom ever!,0.98,7121,<praw.models.comment_forest.CommentForest object at 0x7f954aa4e4d0>,False,https://i.redd.it/y7ouo0xkbye61.jpg,ART,266
mlzg2q,houseplants,If plants were people,0.97,7111,<praw.models.comment_forest.CommentForest object at 0x7f954aab3280>,False,https://v.redd.it/y46kfnhyeqr61,HUMOR/FLUFF,224
iqetcp,houseplants,time for battle,0.98,7097,<praw.models.comment_forest.CommentForest object at 0x7f94da394850>,False,https://i.redd.it/5wy7jezylem51.jpg,HUMOR/FLUFF,165
q8tg4n,houseplants,what I post on social vs what my spouse sees,0.97,7097,<praw.models.comment_forest.CommentForest object at 0x7f94c9e1ef80>,False,https://www.reddit.com/gallery/q8tg4n,PEOPLE: FRIDAYS ONLY,133
h87jz1,houseplants,"Come in, we’ve been expecting you... *strokes plant*",0.98,7086,<praw.models.comment_forest.CommentForest object at 0x7f94c9e7f730>,False,https://i.redd.it/0zfx3f29jo451.jpg,PLANT HOMES,150
ojj7mr,houseplants,The accuracy stings,0.98,7081,<praw.models.comment_forest.CommentForest object at 0x7f94c9ed6c20>,False,https://i.redd.it/fi740irhb0b71.jpg,HUMOR/FLUFF,72
vzq622,houseplants,I took some family photos.,0.95,7074,<praw.models.comment_forest.CommentForest object at 0x7f94c9f2f0a0>,False,https://www.reddit.com/gallery/vzq622,PEOPLE: FRIDAYS ONLY,168
eyyism,houseplants,Love this man!,0.97,7076,<praw.models.comment_forest.CommentForest object at 0x7f94c9f5cc10>,False,https://i.redd.it/n4qi10waize41.jpg,HUMOR/FLUFF,162
hzjsn7,houseplants,Everytime! Even family started mocking me,0.97,7058,<praw.models.comment_forest.CommentForest object at 0x7f94c9fbe620>,False,https://i.redd.it/ew7tey8b3nd51.jpg,HUMOR/FLUFF,140
knzqjp,houseplants,Found another one of you,0.98,7047,<praw.models.comment_forest.CommentForest object at 0x7f94eb5cf880>,False,https://i.imgur.com/eUsQB98.jpg,,70
ngnx2y,houseplants,"It ain’t a million dollar house, but its my favorite place in the world.",0.97,7042,<praw.models.comment_forest.CommentForest object at 0x7f94eb626b60>,False,https://i.redd.it/bhqs696to6071.jpg,PLANT HOMES,186
motja5,houseplants,Looking at you!,0.98,7032,<praw.models.comment_forest.CommentForest object at 0x7f94eb658760>,False,https://i.redd.it/5z5fhd36jks61.jpg,HUMOR/FLUFF,80
ovcx7v,houseplants,This one made me giggle,0.99,7025,<praw.models.comment_forest.CommentForest object at 0x7f94b871f700>,False,https://i.redd.it/vxkywrq9jle71.jpg,HUMOR/FLUFF,74
fb4ai7,houseplants,Y'all....,0.98,7015,<praw.models.comment_forest.CommentForest object at 0x7f94b876ffd0>,False,https://i.redd.it/7fxinyhdbrj41.jpg,,163
