ID,Subreddit,Title,Upvote,Score,Comments,Edited,URL,Flair Text,Nums of Comment
115by41,houseplants,I made a botanical backgammon and chess set with preserved nature,0.98,6457,<praw.models.comment_forest.CommentForest object at 0x7f94daeac2b0>,False,https://www.reddit.com/gallery/115by41,Stuff: SATURDAYS ONLY,136
zm4iff,houseplants,Accurate.,0.98,6457,<praw.models.comment_forest.CommentForest object at 0x7f94daf197e0>,False,https://i.redd.it/1peo3be1gz5a1.jpg,DISCUSSION,132
h08xc7,houseplants,Just vibin,0.97,6452,<praw.models.comment_forest.CommentForest object at 0x7f94daf68970>,False,https://i.redd.it/j40nelrrh2451.jpg,HIGHLIGHT,142
osqivn,houseplants,I don’t always have to know someone to know that they’re my family.,0.98,6445,<praw.models.comment_forest.CommentForest object at 0x7f94dafc76d0>,False,https://i.redd.it/uyxgrubabsd71.jpg,PLANT HOMES,41
mntl9c,houseplants,No plant family photo is complete without a photobombing husband.,0.99,6455,<praw.models.comment_forest.CommentForest object at 0x7f94b9172140>,False,https://i.redd.it/27pcwx3gi8s61.jpg,FAMILY PHOTO,124
onkscv,houseplants,I’m unreasonably proud of this creation,0.98,6447,<praw.models.comment_forest.CommentForest object at 0x7f94b9172200>,False,https://www.reddit.com/gallery/onkscv,HIGHLIGHT,114
jbnorl,houseplants,My co workers are the best,0.98,6442,<praw.models.comment_forest.CommentForest object at 0x7f94da6acd30>,False,https://www.reddit.com/gallery/jbnorl,PLANT HOMES,163
gzcyx1,houseplants,🤷🏻‍♀️😂,0.97,6440,<praw.models.comment_forest.CommentForest object at 0x7f94db4eb4f0>,False,https://i.redd.it/t5ne8054es351.jpg,HUMOR/FLUFF,64
l1mzns,houseplants,I posted this in r/embroidery and they said you all would like it! My first embroidery project,0.98,6438,<praw.models.comment_forest.CommentForest object at 0x7f94db564c10>,False,https://i.redd.it/e1sqispg1lc61.jpg,ART,76
11i19tr,houseplants,Same,0.98,6434,<praw.models.comment_forest.CommentForest object at 0x7f94b925bf10>,False,https://i.redd.it/mpisunpn3sla1.jpg,Humor/Fluff,33
r6e5y3,houseplants,This is now my tradescantia's house. I just live in it.,0.99,6434,<praw.models.comment_forest.CommentForest object at 0x7f94b9262b00>,False,https://i.redd.it/ljd2vxp1ix281.jpg,PLANT HOMES,129
nvy7cj,cscareerquestions,My Reddit account cost me my next SDE job(95% sure),0.95,6433,<praw.models.comment_forest.CommentForest object at 0x7f94b9262ec0>,1623272860.0,https://www.reddit.com/r/cscareerquestions/comments/nvy7cj/my_reddit_account_cost_me_my_next_sde_job95_sure/,,1009
j0t3td,houseplants,I took a really gorgeous picture of my elephant ear and I wanted to share with people who’d care.,0.99,6415,<praw.models.comment_forest.CommentForest object at 0x7f94b92b9090>,False,https://i.redd.it/z6d4p5mhmpp51.jpg,HIGHLIGHT,95
pnuuv8,houseplants,I painted the wall behind my TV with a fun mural to highlight my plants! 😍,0.96,6399,<praw.models.comment_forest.CommentForest object at 0x7f954ab048e0>,False,https://www.reddit.com/gallery/pnuuv8,PLANT HOMES,143
msh3gw,houseplants,Saw this window today at a red light in my drive home,0.99,6395,<praw.models.comment_forest.CommentForest object at 0x7f954ab67df0>,False,https://i.redd.it/mhc03n2lxmt61.jpg,HUMOR/FLUFF,98
xg4lho,houseplants,My mom sent me this- don’t know the source- but made me laugh!,0.99,6395,<praw.models.comment_forest.CommentForest object at 0x7f954ab9be80>,False,https://i.redd.it/ww686w0koao91.jpg,HUMOR/FLUFF,55
cekrps,houseplants,My wife sent me this,0.98,6400,<praw.models.comment_forest.CommentForest object at 0x7f954ab9c3a0>,False,https://i.redd.it/pcx14dq7aya31.jpg,,92
w2ckbi,houseplants,Summer Growth,0.99,6392,<praw.models.comment_forest.CommentForest object at 0x7f94daff83a0>,False,https://www.reddit.com/gallery/w2ckbi,PLANT HOMES,122
11zqby3,houseplants,lmaoo,0.97,6392,<praw.models.comment_forest.CommentForest object at 0x7f94db0341f0>,False,https://i.redd.it/vnd2dca99kpa1.jpg,Humor/Fluff,53
tvmqig,houseplants,Hands off my Euphorbia!,0.97,6390,<praw.models.comment_forest.CommentForest object at 0x7f94db07e1d0>,False,https://i.redd.it/bhos2krwaer81.jpg,HUMOR/FLUFF,83
puu85z,houseplants,Me and some of my plant babies.,0.97,6391,<praw.models.comment_forest.CommentForest object at 0x7f94db09a260>,False,https://i.redd.it/pzp5t0z54jp71.jpg,PLANT HOMES,96
eunhcd,houseplants,My all white leaf finally opened up just in time for Monstera Monday!,0.99,6383,<praw.models.comment_forest.CommentForest object at 0x7f94db0ccf70>,False,https://i.redd.it/eszzj3rlibd41.jpg,Success!,86
jbod57,jobs,A Warning About Glassdoor,0.99,6392,<praw.models.comment_forest.CommentForest object at 0x7f94db02ff10>,1602864549.0,https://www.reddit.com/r/jobs/comments/jbod57/a_warning_about_glassdoor/,Interviews,486
u2565p,houseplants,My indoor jungle this spring...,0.99,6381,<praw.models.comment_forest.CommentForest object at 0x7f94ca9e0100>,False,https://i.redd.it/j8h1th3105t81.jpg,HIGHLIGHT,140
mqp4un,houseplants,Loving my polka dots' growth this year 🤗,0.99,6382,<praw.models.comment_forest.CommentForest object at 0x7f94cae3f190>,False,https://i.redd.it/h0g2uyyxp4t61.jpg,HIGHLIGHT,169
12fcyv8,houseplants,My boyfriend and I with our ever-expanding plant collection 😊,0.93,6380,<praw.models.comment_forest.CommentForest object at 0x7f94cae7eec0>,False,https://i.redd.it/h5ochl9u3nsa1.jpg,People: FRIDAYS ONLY,198
yauykh,houseplants,My plant corner,0.99,6367,<praw.models.comment_forest.CommentForest object at 0x7f94cacf8760>,False,https://i.redd.it/rmtag9mkhev91.jpg,STUFF: SATURDAYS ONLY,109
v1mry7,houseplants,"I won’t even live in my regular house part, just so I could be surrounded by plants and light",0.98,6373,<praw.models.comment_forest.CommentForest object at 0x7f94cad70c40>,False,https://i.redd.it/ztcq05nqbs291.jpg,HUMOR/FLUFF,92
kybz4i,houseplants,My wife has insisted I post her 2 yr old Monstera Thai Constellation,0.99,6365,<praw.models.comment_forest.CommentForest object at 0x7f94cadad930>,False,https://i.redd.it/npen32j4hmb61.jpg,HIGHLIGHT,153
tparst,houseplants,I make stained glass house plants for all y'all with two black thumbs.,0.98,6358,<praw.models.comment_forest.CommentForest object at 0x7f94caaa92d0>,False,https://i.redd.it/8ory1779aup81.jpg,STUFF: SATURDAYS ONLY,131
sgktuv,cscareerquestions,The DEFINITIVE way on how to LeetCode properly. (Hint: You are most likely doing it wrong!),0.94,6359,<praw.models.comment_forest.CommentForest object at 0x7f94cab11a50>,False,https://www.reddit.com/r/cscareerquestions/comments/sgktuv/the_definitive_way_on_how_to_leetcode_properly/,,515
h93nak,houseplants,Hanging with a few of my kids.,0.97,6352,<praw.models.comment_forest.CommentForest object at 0x7f94cab58940>,False,https://i.redd.it/8tmmyh7mgy451.jpg,PLANT SELFIE,100
fu7s2b,houseplants,Finished my first embroidery project this week!,0.98,6356,<praw.models.comment_forest.CommentForest object at 0x7f954abd8820>,False,https://imgur.com/BLK7Wdy,,147
iji2zi,houseplants,Curiosity killed the plants,0.99,6349,<praw.models.comment_forest.CommentForest object at 0x7f954abecaf0>,False,https://i.redd.it/owxnxzklr6k51.jpg,PETS AND PLANTS,128
kdc5xl,houseplants,Look at this absolute unit of a Christmas cactus that I inherited!,0.98,6342,<praw.models.comment_forest.CommentForest object at 0x7f954ac44880>,False,https://i.redd.it/8j3asy8ac9561.jpg,HAUL,65
gajka3,houseplants,when I realized you can order plants online...,0.99,6344,<praw.models.comment_forest.CommentForest object at 0x7f954ac8f280>,False,https://i.redd.it/eujuqpz15uv41.jpg,PETS AND PLANTS,146
oyww4e,houseplants,My patio garden in Brisbane,0.98,6328,<praw.models.comment_forest.CommentForest object at 0x7f94b933ca90>,False,https://i.imgur.com/B2ZRBEx.jpg,PLANT HOMES,122
lnm6l4,houseplants,Found one of you guys,0.99,6331,<praw.models.comment_forest.CommentForest object at 0x7f94b939cb50>,False,https://i.redd.it/gq1toljd4hi61.jpg,HELP,72
p649pv,houseplants,🙃i thought a lot of you will agree with my floorplan🙂,0.97,6321,<praw.models.comment_forest.CommentForest object at 0x7f94b93e6b30>,False,https://i.redd.it/y14ywgosbxh71.jpg,HUMOR/FLUFF,143
od6oh1,houseplants,My friends forgot my birthday so I replaced them with plants :),0.97,6322,<praw.models.comment_forest.CommentForest object at 0x7f94b940c2b0>,False,https://www.reddit.com/gallery/od6oh1,HAUL,236
h9ggjo,houseplants,Can't believe them🤦🏻‍♂️,0.99,6320,<praw.models.comment_forest.CommentForest object at 0x7f94caf00130>,False,https://i.redd.it/la9wwv92u2551.png,HUMOR/FLUFF,85
i8njt8,houseplants,Thought I’d share a 5 month progress pic before I give this guy a haircut!,0.99,6318,<praw.models.comment_forest.CommentForest object at 0x7f94caf9f1f0>,False,https://i.redd.it/98nvg5j0cng51.jpg,PLANT HOMES,204
1538ter,jobs,New coworker keeps FARTING in the cubicle next to me.,0.92,6301,<praw.models.comment_forest.CommentForest object at 0x7f94cafc5b10>,False,https://www.reddit.com/r/jobs/comments/1538ter/new_coworker_keeps_farting_in_the_cubicle_next_to/,Office relations,2305
hb30pa,houseplants,My suncatcher and my Swiss cheese plant conspired to create a little magic in my living room this afternoon,0.99,6298,<praw.models.comment_forest.CommentForest object at 0x7f952a133e80>,False,https://i.redd.it/y2ox9jtx3k551.jpg,ART,52
m46c1r,houseplants,🌿🌵Happy Saturday y’all 🌿🌵,0.96,6295,<praw.models.comment_forest.CommentForest object at 0x7f94b9620250>,False,https://i.redd.it/4535onjgssm61.jpg,HUMOR/FLUFF,86
uqmi2u,houseplants,Breaking up with my boyfriend of 10 years and pulling most of my plants together as we move out. These green gals have given me a lot of joy during this time.,0.97,6302,<praw.models.comment_forest.CommentForest object at 0x7f952a138250>,False,https://i.redd.it/hu9q19unarz81.jpg,HIGHLIGHT,168
jt7z8a,houseplants,Mexico City monstera I thought you all would appreciate!,0.99,6297,<praw.models.comment_forest.CommentForest object at 0x7f952a15b2e0>,False,https://i.redd.it/q5yq46pivwy51.jpg,HIGHLIGHT,102
visoto,houseplants,Thirsty little cactus 🌵,0.98,6293,<praw.models.comment_forest.CommentForest object at 0x7f952a1ccf40>,False,https://v.redd.it/ebgpf0nd8c791,HIGHLIGHT,169
154lxsz,jobs,I walked out of a job interview,0.96,6285,<praw.models.comment_forest.CommentForest object at 0x7f94ec9113f0>,False,https://www.reddit.com/r/jobs/comments/154lxsz/i_walked_out_of_a_job_interview/,Interviews,624
gik18x,houseplants,My 19 year old dieffenbachia,0.99,6285,<praw.models.comment_forest.CommentForest object at 0x7f94ec9772b0>,False,https://i.redd.it/yjz9e2p5cey41.jpg,PLANT HOMES,205
nlfcsj,houseplants,Hoya carnosa compacta variegata in bloom- SWOON!,0.99,6280,<praw.models.comment_forest.CommentForest object at 0x7f94db887bb0>,False,https://www.reddit.com/gallery/nlfcsj,HIGHLIGHT,243
l08lye,houseplants,shout out to the people who don’t understand our plant obsession but support us anyway 🪴,0.99,6282,<praw.models.comment_forest.CommentForest object at 0x7f94caefbf40>,False,https://i.redd.it/0exm6upyv6c61.jpg,ART,84
iw0hek,houseplants,"My sanctuary, last year to this year.",0.98,6285,<praw.models.comment_forest.CommentForest object at 0x7f94b94f4040>,False,https://i.redd.it/380smclp26o51.jpg,HIGHLIGHT,100
sg7cal,houseplants,That's amazing,0.98,6279,<praw.models.comment_forest.CommentForest object at 0x7f94b9512890>,False,https://v.redd.it/3std47sw8se81,HIGHLIGHT,227
ep3rlb,houseplants,I found this online and I thought y'all would love it as much as I do.,0.96,6280,<praw.models.comment_forest.CommentForest object at 0x7f94cb13ee60>,False,https://i.redd.it/4n3i1ufsoya41.jpg,Success!,58
p1rpj4,houseplants,My grow light set up in the shaded alcove of my room. Thinking of adding a few more 😂,0.99,6271,<praw.models.comment_forest.CommentForest object at 0x7f94cb1d0d30>,False,https://i.redd.it/gto0ns52wjg71.jpg,PLANT HOMES,326
k1lmhg,houseplants,I wanted a functional room divider/plant stand so I welded this baby up!,0.99,6261,<praw.models.comment_forest.CommentForest object at 0x7f94cb1e9ba0>,False,https://www.reddit.com/gallery/k1lmhg,ART,121
p46lve,houseplants,Found in a different sub. Definitely think it belongs here too.,0.97,6260,<praw.models.comment_forest.CommentForest object at 0x7f94b9710580>,False,https://i.redd.it/75eu11awabh71.png,HUMOR/FLUFF,49
g3t2n1,houseplants,Timelapse of my Hoya bella blooming!,0.99,6253,<praw.models.comment_forest.CommentForest object at 0x7f94b973dcf0>,False,https://v.redd.it/nfug6aykkmt41,HIGHLIGHT,89
hcmluv,houseplants,Happy Fathers Days,0.97,6248,<praw.models.comment_forest.CommentForest object at 0x7f94b9756440>,False,https://i.redd.it/1gkp1ppil2651.jpg,SELFIE,57
gixpzj,houseplants,My string of pearls is blooming! The flowers have made the entire room smell like cinnamon for days,0.99,6251,<praw.models.comment_forest.CommentForest object at 0x7f94b978dab0>,False,https://i.redd.it/svj6n9v0wiy41.jpg,,124
v4sc0t,houseplants,I love my plant wall and want to show everyone,0.99,6247,<praw.models.comment_forest.CommentForest object at 0x7f94b97fbfa0>,False,https://i.imgur.com/wUwDQUH.jpg,HIGHLIGHT,140
12jknbt,houseplants,The daily struggle,0.98,6241,<praw.models.comment_forest.CommentForest object at 0x7f94b9800490>,False,https://i.redd.it/gscw9hxsnhta1.jpg,Humor/Fluff,98
und4rk,houseplants,"Rescued this guy from the trash, just put out its first new leaf!",0.99,6243,<praw.models.comment_forest.CommentForest object at 0x7f94b985ba60>,False,https://v.redd.it/8ha2mk1pcvy81,HIGHLIGHT,110
klpddx,houseplants,Thought you guys would appreciate this Jigsaw I got for Christmas,0.98,6237,<praw.models.comment_forest.CommentForest object at 0x7f94db5bb8e0>,False,https://i.redd.it/chiqzj0u4x761.jpg,ART,70
kc17a4,houseplants,"I see your face pots with funny hair, and raise you a turtle with turtle shells shell.",0.98,6241,<praw.models.comment_forest.CommentForest object at 0x7f94db6043d0>,False,https://www.reddit.com/gallery/kc17a4,HIGHLIGHT,66
jx2mkb,houseplants,One of my favorite times of day,0.99,6229,<praw.models.comment_forest.CommentForest object at 0x7f94db626020>,False,https://i.redd.it/e4z3bjdj77061.jpg,PETS AND PLANTS,86
gtlna6,houseplants,"Update: Target refunded me, but I got out my glue, bought some gold paint, and tried my hand at kintsugi. Two new pots for just the price of the paint!",0.98,6227,<praw.models.comment_forest.CommentForest object at 0x7f94db65b370>,False,https://i.redd.it/rmh3wye2uy151.jpg,HUMOR/FLUFF,145
opd6xj,houseplants,The current state of my plant shopping,0.98,6219,<praw.models.comment_forest.CommentForest object at 0x7f94db6867a0>,False,https://v.redd.it/9khn0x4rgrc71,HUMOR/FLUFF,159
okogy1,houseplants,I can't be the only one,0.98,6216,<praw.models.comment_forest.CommentForest object at 0x7f94eca662c0>,False,https://i.redd.it/goc303hg5cb71.jpg,HUMOR/FLUFF,143
i4qenh,houseplants,my newest hand painted pot! suggestions on which plants would look coolest in it?,0.98,6213,<praw.models.comment_forest.CommentForest object at 0x7f94ecac7730>,False,https://i.redd.it/ig6so9w5fdf51.png,PLANT HOMES,190
kcbfn8,houseplants,My indoor moss garden coffee table,0.97,6209,<praw.models.comment_forest.CommentForest object at 0x7f94db696e90>,False,https://i.redd.it/6qtzhfkafqr41.jpg,PLANT HOMES,68
hg73is,houseplants,"Dirty mirror selfie with some of my bedroom plants. Terrible picture, but wonderful feeling. :)",0.96,6203,<praw.models.comment_forest.CommentForest object at 0x7f94db72bc10>,False,https://i.redd.it/h6dxxcpk59751.jpg,FAMILY PHOTO,181
gl2q4q,houseplants,My girlfriend did not really understand how big the cactus was. The excitement is real. Lol,0.96,6208,<praw.models.comment_forest.CommentForest object at 0x7f94db72bfd0>,False,https://i.redd.it/v20uwnuw27z41.jpg,HIGHLIGHT,154
dcbiji,houseplants,I got a monstera tattoo climbing up my arm! Here it is next to my plants,0.91,6206,<praw.models.comment_forest.CommentForest object at 0x7f94b98729e0>,False,https://i.redd.it/o7fjigur85q31.jpg,,180
iatn4a,houseplants,String of turtles in a turtle. Redundant? Maybe. It makes me 🤓😍,0.98,6199,<praw.models.comment_forest.CommentForest object at 0x7f94b98caf50>,False,https://i.redd.it/ofhaxy83odh51.jpg,HUMOR/FLUFF,87
wz5ley,houseplants,"Anyone have an ID? I was worried it might be toxic to my cats, but they disappeared soon after I brought it home",0.95,6194,<praw.models.comment_forest.CommentForest object at 0x7f94b99403a0>,False,https://www.reddit.com/gallery/wz5ley,PLANT ID,229
h9uwbz,houseplants,Family pic! This handsome cactus was my 23rd plant for my 23rd birthday today! 🌵💖,0.97,6195,<praw.models.comment_forest.CommentForest object at 0x7f94b9963640>,False,https://i.redd.it/iseeg2guq6551.jpg,PLANT SELFIE,220
lnxiav,houseplants,Feb 2020: 2 house plants. Feb 2021: 22 house plants.,0.97,6192,<praw.models.comment_forest.CommentForest object at 0x7f94cb2be980>,False,https://i.redd.it/9tx4imj0sji61.jpg,FAMILY PHOTO,222
v6bm6a,houseplants,"Plants, cats and booze sounds alright to me.",0.99,6180,<praw.models.comment_forest.CommentForest object at 0x7f94ecb44c40>,False,https://i.redd.it/cwixc3d5z1491.jpg,HUMOR/FLUFF,50
mxfstw,houseplants,"I was lazy and didn’t want to keep removing the pups, so I decided to just let my Pilea grow undisturbed in a large pot. It’s now 70 cm tall.",0.99,6189,<praw.models.comment_forest.CommentForest object at 0x7f94ecbe15a0>,False,https://i.redd.it/vt4beww013v61.jpg,HIGHLIGHT,147
krncw4,houseplants,"Thank you plants, for giving me a distraction from the chaos around us",0.99,6180,<praw.models.comment_forest.CommentForest object at 0x7f94ecbe2e60>,False,https://i.redd.it/7initnw2mp961.jpg,PETS AND PLANTS,123
yuc8xm,houseplants,I stitched together over 10k photos to make this timelapse of a monstera leaf emerging. (~10 days),0.98,6179,<praw.models.comment_forest.CommentForest object at 0x7f94ecc427a0>,False,https://v.redd.it/r480456dxrz91,HIGHLIGHT,91
10hvgsx,houseplants,I made a houseplant quilt to keep me warm in my room full of plants.,0.99,6168,<praw.models.comment_forest.CommentForest object at 0x7f94eccb5840>,False,https://i.redd.it/8ui9uyczdfda1.jpg,Stuff: SATURDAYS ONLY,91
126t8sg,houseplants,Make it make sense!,0.99,6166,<praw.models.comment_forest.CommentForest object at 0x7f94eccb7af0>,False,https://i.redd.it/zs8dpuyrayqa1.jpg,Discussion,272
cdh3u8,houseplants,Surveying his kingdom,0.98,6169,<praw.models.comment_forest.CommentForest object at 0x7f94ecceb130>,False,https://i.redd.it/tax4id1ksga31.jpg,Success!,128
lw7g7b,houseplants,I'm sure my plants look at me like this!,0.99,6158,<praw.models.comment_forest.CommentForest object at 0x7f94db9b3ee0>,False,https://i.redd.it/wsjo8vw1gnk61.jpg,HUMOR/FLUFF,30
gku49q,houseplants,So in love with my new Velma Cox Geranium! The colors 😍,0.99,6164,<praw.models.comment_forest.CommentForest object at 0x7f94db9ba680>,False,https://i.redd.it/r72r0g7gi4z41.jpg,HIGHLIGHT,125
hsl78o,houseplants,Just finished making this pegboard for my plants.,0.99,6154,<praw.models.comment_forest.CommentForest object at 0x7f94db9ba590>,False,https://i.redd.it/vofayhp14bb51.jpg,PLANT HOMES,110
13y2ecd,houseplants,"Everyone, meet Lady Gaga, aka: Mother Monstera…",0.99,6143,<praw.models.comment_forest.CommentForest object at 0x7f94cb360d60>,False,https://www.reddit.com/gallery/13y2ecd,Pets and Plants,211
lpovta,houseplants,Y’all always enjoy my jungle bathroom pics. Here’s my wild dining room.,0.99,6143,<praw.models.comment_forest.CommentForest object at 0x7f94cb3a1450>,False,https://i.imgur.com/fdfWWSw.jpg,,100
m18x2r,houseplants,Went camping for a week. Came back to this. 🥲,0.99,6147,<praw.models.comment_forest.CommentForest object at 0x7f955aa028f0>,False,https://i.redd.it/0wkba6rxu0m61.jpg,HIGHLIGHT,74
xlh88c,houseplants,I used a tea light candelabra for my hanging plant,0.98,6133,<praw.models.comment_forest.CommentForest object at 0x7f955aa42c50>,False,https://www.reddit.com/gallery/xlh88c,HIGHLIGHT,118
ky27ph,houseplants,Something nice for you guys,0.98,6122,<praw.models.comment_forest.CommentForest object at 0x7f955aa78e20>,False,https://v.redd.it/b0mlcto9vjb61,HUMOR/FLUFF,55
uq37jd,houseplants,Interesting,0.99,6132,<praw.models.comment_forest.CommentForest object at 0x7f955aabad70>,False,https://i.imgur.com/plipe6M.jpg,HUMOR/FLUFF,64
kgibdf,houseplants,"Not my house, but I stayed at this hotel in Copenhagen this summer: thought you might love it!",0.99,6126,<praw.models.comment_forest.CommentForest object at 0x7f955aadb220>,False,https://www.reddit.com/gallery/kgibdf,HIGHLIGHT,48
jrh6hd,houseplants,Succulent produced a flower,0.99,6125,<praw.models.comment_forest.CommentForest object at 0x7f94db9dc5e0>,False,https://i.redd.it/zonaurl3fdy51.jpg,HIGHLIGHT,106
ft1eb2,houseplants,Thought you guys might like this,0.98,6110,<praw.models.comment_forest.CommentForest object at 0x7f94db9fc820>,False,https://i.redd.it/l9lfc9te18q41.jpg,HUMOR/FLUFF,24
owpt4n,houseplants,My lovely goth girl: oxalis spiralis,0.98,6113,<praw.models.comment_forest.CommentForest object at 0x7f94dba42b60>,False,https://i.redd.it/a26xelmew0f71.jpg,HIGHLIGHT,73
tpklh1,houseplants,Look at this new leaf thooo,0.99,6105,<praw.models.comment_forest.CommentForest object at 0x7f94dba42b30>,False,https://www.reddit.com/gallery/tpklh1,HIGHLIGHT,83
o90y6t,houseplants,Still can’t believe I found such a beauty for only $10!,0.98,6107,<praw.models.comment_forest.CommentForest object at 0x7f94dba78ac0>,False,https://i.redd.it/8kxogu4o9u771.jpg,HAUL,92
hdhu4o,houseplants,Father’s Day project with my dad! My very own propagation station.,0.99,6098,<praw.models.comment_forest.CommentForest object at 0x7f94dbaa3b20>,False,https://i.redd.it/kk8nw6lcwc651.jpg,ART,88
rvv1o2,houseplants,I like interior decorating with my plants,0.98,6105,<praw.models.comment_forest.CommentForest object at 0x7f94ecd1f3a0>,False,https://www.reddit.com/gallery/rvv1o2,PLANT HOMES,206
xd5abw,houseplants,My little sanctuary,0.97,6093,<praw.models.comment_forest.CommentForest object at 0x7f94ecd5a290>,False,https://i.redd.it/41bgr1xq5mn91.jpg,HIGHLIGHT,283
no70a3,houseplants,Sorry if this has been postet before.,0.99,6099,<praw.models.comment_forest.CommentForest object at 0x7f94ecdef2e0>,False,https://i.redd.it/7sd24qbt08271.jpg,HUMOR/FLUFF,55
irasnt,houseplants,Just happy to know I'm not the only one 😅❤️🌿,0.97,6090,<praw.models.comment_forest.CommentForest object at 0x7f94eceb22c0>,False,https://i.redd.it/t4hzcqjlapm51.jpg,HUMOR/FLUFF,137
13f252f,houseplants,Just impulse bought the f*ck out of this here houseplant,0.97,6091,<praw.models.comment_forest.CommentForest object at 0x7f94db4eb400>,False,https://www.reddit.com/gallery/13f252f,Highlight,212
rz1gwh,houseplants,I grew it and I ate it 🍊,0.98,6089,<praw.models.comment_forest.CommentForest object at 0x7f94b9973eb0>,False,https://www.reddit.com/gallery/rz1gwh,Before / After - Progress Pics,134
qt4iwy,houseplants,A tiny watercolor of my fern.,0.99,6096,<praw.models.comment_forest.CommentForest object at 0x7f94b9a15390>,False,https://i.redd.it/dg0ybwct1ez71.jpg,STUFF: SATURDAYS ONLY,55
lrf8rx,houseplants,"Hurry guys, quick Renaissance photo",0.97,6082,<praw.models.comment_forest.CommentForest object at 0x7f94b9a5b2e0>,False,https://i.redd.it/boihnl5vzfj61.jpg,PETS AND PLANTS,82
k1x1tx,houseplants,See? We ARE contributing.,0.98,6091,<praw.models.comment_forest.CommentForest object at 0x7f94ecf1f4f0>,False,https://i.redd.it/u7gapniooq161.jpg,HUMOR/FLUFF,78
lj9rkz,houseplants,My air plant octopus,0.99,6084,<praw.models.comment_forest.CommentForest object at 0x7f94ecf526b0>,False,https://i.redd.it/fus7muzbcbh61.jpg,PLANT HOMES,87
ihl5hr,houseplants,Newcomers to the hobby (oc),0.99,6076,<praw.models.comment_forest.CommentForest object at 0x7f94ecf80d00>,False,https://i.redd.it/ltluuolusjj51.png,HUMOR/FLUFF,218
i2x8nh,houseplants,"We just moved into our first home, Sunroom is buzzing !",0.99,6072,<praw.models.comment_forest.CommentForest object at 0x7f94ecfb79a0>,False,https://v.redd.it/7tp8ki3vjse51,PLANT HOMES,114
nswmst,houseplants,I make creepy plant guys,0.98,6068,<praw.models.comment_forest.CommentForest object at 0x7f94cb55d900>,False,https://i.redd.it/63jfxpsmgg371.jpg,STUFF: SATURDAYS ONLY,181
z0hqh5,houseplants,Free marketplace score,0.98,6069,<praw.models.comment_forest.CommentForest object at 0x7f94cb5971c0>,False,https://i.redd.it/ue4h41or681a1.jpg,PLANT HOMES,222
12s252l,houseplants,The optimal place for your peace lily,0.88,6074,<praw.models.comment_forest.CommentForest object at 0x7f94dbb4beb0>,False,https://i.redd.it/m0d5t22luwua1.jpg,Humor/Fluff,582
ijd6av,houseplants,I'm repotting my boyfriend's plants after he told me that they don't need bigger pots,0.98,6066,<praw.models.comment_forest.CommentForest object at 0x7f94dbb503d0>,False,https://i.redd.it/4wkwdgkpc5k51.jpg,HUMOR/FLUFF,201
gouhjc,houseplants,"YAY FOR GROWTH! Fiddle Leaf Fig, 7/2019 vs 5/2020",0.99,6069,<praw.models.comment_forest.CommentForest object at 0x7f94b9b541f0>,False,https://i.redd.it/q5bb3s56ke051.jpg,DISCUSSION,145
ml12fv,houseplants,Thirsty boys,0.98,6053,<praw.models.comment_forest.CommentForest object at 0x7f94ed05c400>,False,https://i.redd.it/b7hnf1g7pgr61.jpg,HUMOR/FLUFF,68
k91oud,houseplants,Did y'all just move togheter in the same neighborhood?,0.99,6050,<praw.models.comment_forest.CommentForest object at 0x7f94ed0c0820>,False,https://i.redd.it/xc7wcfultx361.jpg,HUMOR/FLUFF,144
l33d4a,houseplants,Husband hung a ladder from the ceiling so I had somewhere to put all of my hanging plants!,0.99,6047,<praw.models.comment_forest.CommentForest object at 0x7f94ed0ddc60>,False,https://i.redd.it/6knx1k8nvzc61.jpg,FAMILY PHOTO,88
12zhyw1,houseplants,😄,0.97,6044,<praw.models.comment_forest.CommentForest object at 0x7f94b9b91e40>,False,https://v.redd.it/y3nnb39wf8wa1,Humor/Fluff,60
11rfxfn,houseplants,ZZ Plant. I need help finding a ZZ Plant bigger than mine. It’s about 5 years old.,0.96,6036,<praw.models.comment_forest.CommentForest object at 0x7f94b9bc0ca0>,False,https://i.redd.it/noa4676u8una1.jpg,Discussion,686
