ID,Subreddit,Title,Upvote,Score,Comments,Edited,URL,Flair Text,Nums of Comment
v4755l,houseplants,Look who decided to make a nest in my spider plant!,0.98,9769,<praw.models.comment_forest.CommentForest object at 0x7f94fe64c550>,False,https://www.reddit.com/gallery/v4755l,PETS AND PLANTS,211
xbv5bb,houseplants,My avocado tree decided to be albino!,0.98,9761,<praw.models.comment_forest.CommentForest object at 0x7f94fe688160>,False,https://i.redd.it/jw40233cyan91.jpg,HIGHLIGHT,171
j4h02z,houseplants,My friend handmade this Monstera necklace for me as a birthday gift,0.98,9725,<praw.models.comment_forest.CommentForest object at 0x7f94d804d000>,False,https://i.redd.it/cbbonuxifwq51.jpg,ART,113
hpfpps,houseplants,I’m not worthy,0.98,9686,<praw.models.comment_forest.CommentForest object at 0x7f94d80bee90>,False,https://i.redd.it/ehl0grch1aa51.jpg,HIGHLIGHT,95
mmsrhv,houseplants,Basking in the morning sun ☀️,0.98,9686,<praw.models.comment_forest.CommentForest object at 0x7f94d80ffaf0>,False,https://i.redd.it/u7hqagi9kyr61.jpg,PETS AND PLANTS,172
kz66xk,houseplants,when you get a new plant,0.98,9686,<praw.models.comment_forest.CommentForest object at 0x7f950fce7820>,False,https://i.redd.it/ut0jcfvo6wb61.jpg,ART,78
11jzkf2,houseplants,So that's why it's called a cat palm...,0.98,9671,<praw.models.comment_forest.CommentForest object at 0x7f950fd590c0>,False,https://i.redd.it/u7ejlh5616ma1.jpg,Pets and Plants,98
oratfc,houseplants,"Finished my sleeve, thought you guys might appreciate it!",0.93,9667,<praw.models.comment_forest.CommentForest object at 0x7f950fd7b5e0>,False,https://i.redd.it/cumsgbc9tcd71.jpg,HUMOR/FLUFF,182
14xw4zi,jobs,“We made a mistake on your job offer” - 20% pay cut after accepting and onboarding with giant company. Anything I can do?,0.95,9639,<praw.models.comment_forest.CommentForest object at 0x7f94fe6cb850>,False,https://www.reddit.com/r/jobs/comments/14xw4zi/we_made_a_mistake_on_your_job_offer_20_pay_cut/,Job offers,2644
ugics8,houseplants,Hmmm… or is it because of the tap water? 🤣,0.98,9629,<praw.models.comment_forest.CommentForest object at 0x7f94fe742290>,False,https://i.redd.it/zco5bxpn4wg71.jpg,HELP,179
jwgru2,houseplants,Leaf appreciation post!!,0.98,9624,<praw.models.comment_forest.CommentForest object at 0x7f9568a511e0>,False,https://i.redd.it/btxzpaife0061.jpg,HIGHLIGHT,121
jpv614,houseplants,I painted a picture of myself waiting for my husband to give into my plant addiction...,0.97,9618,<praw.models.comment_forest.CommentForest object at 0x7f9568a93580>,False,https://i.redd.it/ipu0f06u0vx51.jpg,ART,185
opzpjq,houseplants,I want to brag with people that understand my excitement. My orbifola has sprouted SEVEN new leaves!!,0.98,9610,<praw.models.comment_forest.CommentForest object at 0x7f94fe7ebca0>,False,https://www.reddit.com/gallery/opzpjq,HIGHLIGHT,217
gjt5gv,houseplants,Operation “Get giant cactus out of car” was a success!!,0.98,9602,<praw.models.comment_forest.CommentForest object at 0x7f94fe7f00a0>,False,https://i.redd.it/qlxxoogo7sy41.jpg,HAUL,185
ztz0ye,houseplants,"My dad wanted me to share this with y'all. It's his prized peach tree, lent it to the community for lunar new year. We think it's over 12 years old.",0.98,9598,<praw.models.comment_forest.CommentForest object at 0x7f94fe871840>,False,https://i.redd.it/ippbb388ps7a1.jpg,HIGHLIGHT,115
l2bmah,houseplants,I’m feeling the Bern,0.93,9594,<praw.models.comment_forest.CommentForest object at 0x7f94e94a0c40>,False,https://i.redd.it/wvdbq23s1sc61.jpg,HUMOR/FLUFF,52
idsczp,houseplants,WELCOME TO MY HANGING PLANT JUNGLE. 💚,0.97,9584,<praw.models.comment_forest.CommentForest object at 0x7f94e94e63e0>,False,https://i.redd.it/bpf7ms4j6bi51.jpg,ART,175
nm5ygo,houseplants,Buddhas Temple flex (supported with a chopstick). I never thought I'd get one to flower,0.99,9587,<praw.models.comment_forest.CommentForest object at 0x7f94e95023b0>,False,https://i.redd.it/at0h0ubwln171.jpg,HIGHLIGHT,163
kn3fa9,houseplants,What a few months in a south facing window can do,0.98,9583,<praw.models.comment_forest.CommentForest object at 0x7f94e9574670>,False,https://i.redd.it/6gw06x6m5c861.jpg,PLANT HOMES,213
t30msk,houseplants,A year ago I did a cutting swap with a fellow redditor and they gave me this lil Monstera Adansonii. Swipe to see it today!,0.98,9571,<praw.models.comment_forest.CommentForest object at 0x7f94d8159810>,False,https://www.reddit.com/gallery/t30msk,Before / After - Progress Pics,154
lcif8y,houseplants,Amazing evening vibes after spending the day tending to the plants ✨,0.98,9552,<praw.models.comment_forest.CommentForest object at 0x7f94d81e6e00>,False,https://i.redd.it/i0d75dqfehf61.jpg,PLANT HOMES,155
gooj2c,houseplants,"i feel weird posting on reddit now because i got dragged for being trans on a different sub...,, but i truly love this sub and i'm thankful for you all. this is my new norfolk pine :). i called and reserved their last one, the lady saw how excited i was and extremely discounted it to $20.",0.79,9520,<praw.models.comment_forest.CommentForest object at 0x7f94fe687f70>,False,https://i.imgur.com/FesPyc9.jpg,,340
zzgmhb,houseplants,Happy Friday! My green corner,0.97,9517,<praw.models.comment_forest.CommentForest object at 0x7f950fe4c070>,False,https://i.redd.it/algqewnf869a1.jpg,PEOPLE: FRIDAYS ONLY,118
kwrnmu,houseplants,"My daughter: “”Where am I supposed to find 10 different leaves for science class, it’s the middle of winter?!?” Me: “Hold my fertilizer...”",0.97,9517,<praw.models.comment_forest.CommentForest object at 0x7f94e9602410>,False,https://i.redd.it/lay8ou4me6b61.jpg,HUMOR/FLUFF,150
l7s9pb,houseplants,All my kids.,0.98,9506,<praw.models.comment_forest.CommentForest object at 0x7f94e9637bb0>,False,https://i.redd.it/zcnu9aimu9e61.jpg,FAMILY PHOTO,146
kflglp,houseplants,Ice Monstera,0.98,9515,<praw.models.comment_forest.CommentForest object at 0x7f94d820f730>,False,https://i.redd.it/jby0l0bjay561.jpg,ART,71
pwef48,houseplants,Couldn’t ask for anything more…,0.99,9485,<praw.models.comment_forest.CommentForest object at 0x7f94d826ace0>,False,https://i.redd.it/pjvj8hn0z0q71.jpg,PLANT HOMES,158
oxbq95,houseplants,"Huh, I found this on my money tree on my porch this morning 😅🤣💀💀",0.98,9425,<praw.models.comment_forest.CommentForest object at 0x7f94d8299060>,False,https://www.reddit.com/gallery/oxbq95,HIGHLIGHT,319
m7rtfh,houseplants,My boyfriend and I made plant pots based on each other’s faces,0.97,9422,<praw.models.comment_forest.CommentForest object at 0x7f94d82f54b0>,False,https://i.redd.it/18nu4hkkpsn61.jpg,ART,125
hxo26q,houseplants,Not exactly aesthetically pleasing but keeps my cats from digging in the dirt to bite the leaves.,0.98,9426,<praw.models.comment_forest.CommentForest object at 0x7f950ff876a0>,False,https://i.imgur.com/oOCr6Ap.jpg,PETS AND PLANTS,340
fn7ovz,houseplants,"Self portrait, quarantine edition",0.99,9407,<praw.models.comment_forest.CommentForest object at 0x7f950ffbd2d0>,False,https://i.redd.it/lstgnwaylao41.jpg,HUMOR/FLUFF,76
grur4d,houseplants,My Hindu Rope Plant in bloom. 😍,0.98,9388,<praw.models.comment_forest.CommentForest object at 0x7f94c80e0dc0>,False,https://i.redd.it/ka2e9avi5e151.jpg,,140
izmpho,houseplants,seen on twitter and had to share,0.97,9383,<praw.models.comment_forest.CommentForest object at 0x7f94c80f6da0>,False,https://i.redd.it/9k6cg7ogmbp51.jpg,HUMOR/FLUFF,95
lzavlk,houseplants,Purchased the most perfect little prick and wanted to share. He’s just so wee! 🥺,0.97,9354,<praw.models.comment_forest.CommentForest object at 0x7f94c816a2f0>,False,https://i.redd.it/7kyqz1sz0hl61.jpg,HUMOR/FLUFF,155
gfrrug,houseplants,Just got the finished sample for my new pin. This is for all the peace lily owners out there.,0.97,9348,<praw.models.comment_forest.CommentForest object at 0x7f94c819de70>,False,https://i.redd.it/e46kk0kv4jx41.jpg,HUMOR/FLUFF,238
mxn1i0,houseplants,"Got sober, been spending all my former drug money on plants",0.98,9340,<praw.models.comment_forest.CommentForest object at 0x7f94c81fa050>,False,https://i.imgur.com/u57rQG7.jpg,FAMILY PHOTO,218
gx6ujo,houseplants,"My wife kept bringing home nearly dead orchids from work that her coworkers stopped caring after they lost all of their flowers insisting you could get them to flower again, I did not believe her, I was very wrong.",0.99,9333,<praw.models.comment_forest.CommentForest object at 0x7f94d8391d50>,False,https://i.redd.it/i16k9u6r24351.jpg,HUMOR/FLUFF,300
fno6bh,houseplants,"As much as I love this room, I regret saying that I wished I never had to leave it 😅",0.98,9334,<praw.models.comment_forest.CommentForest object at 0x7f953a99aa40>,False,https://i.redd.it/u5f2d42flgo41.jpg,PLANT HOMES,104
1337pmx,houseplants,Well…? Apparently “Happy Frog” potting soil is quite literal. Repotted a plant today and this guy tunneled out an hour later.,0.98,9323,<praw.models.comment_forest.CommentForest object at 0x7f953aa5b6d0>,False,https://i.redd.it/0u91j6xwqxwa1.jpg,Humor/Fluff,202
i2nrpw,houseplants,SheShe's a happy gal! 9’ ceiling - East/south windows,0.98,9311,<praw.models.comment_forest.CommentForest object at 0x7f953aa839d0>,False,https://i.redd.it/rbllwr0wtoe51.jpg,HIGHLIGHT,169
nua6vz,houseplants,I feel like posting this under every second houseplant problem post ...,0.97,9304,<praw.models.comment_forest.CommentForest object at 0x7f94fe9508e0>,False,https://i.redd.it/4l5ed1bqxt371.png,HUMOR/FLUFF,498
j546xd,houseplants,Echeveria bloomed in to a heart💗,0.98,9298,<praw.models.comment_forest.CommentForest object at 0x7f94fe9addb0>,False,https://www.reddit.com/gallery/j546xd,PETS AND PLANTS,52
o872px,houseplants,"I feel like this community will understand my excitement, changed roles at work and now run the garden department!",0.98,9292,<praw.models.comment_forest.CommentForest object at 0x7f94d87a1cf0>,False,https://i.redd.it/c36ew1hupk771.jpg,STUFF: SATURDAYS ONLY,150
krb8xj,houseplants,a fellow redditor said my art belonged here,0.97,9274,<praw.models.comment_forest.CommentForest object at 0x7f94d87a9d80>,False,https://i.redd.it/gfesmzjoql961.jpg,,149
p9a3ib,houseplants,Got fed up w/ supposed “pots/planters” not having ANY drainage & bought drill bits for glass. I’m undeterred by ur decorative bs and my power is limitless,0.98,9250,<praw.models.comment_forest.CommentForest object at 0x7f94d87fe260>,False,https://www.reddit.com/gallery/p9a3ib,STUFF: SATURDAYS ONLY,372
g6x8f2,houseplants,My living room💚,0.97,9249,<praw.models.comment_forest.CommentForest object at 0x7f94fe9da920>,False,https://i.redd.it/jzfemxnihnu41.jpg,PLANT HOMES,210
m3kgto,houseplants,Little evening sun,0.98,9210,<praw.models.comment_forest.CommentForest object at 0x7f954a6d4a90>,False,https://i.redd.it/ylhwbt2cdmm61.jpg,PLANT HOMES,113
ktyr2v,houseplants,Because Cake Day and I love this sub!,0.98,9223,<praw.models.comment_forest.CommentForest object at 0x7f954a735b10>,False,https://i.redd.it/gtfyskfu9da61.jpg,FAMILY PHOTO,146
ze8qzn,houseplants,"In May this year my dad passed away and left me his 40 year old Weeping Fig tree, now I’m continuing the tradition of making it our Christmas tree.",0.98,9203,<praw.models.comment_forest.CommentForest object at 0x7f954a772aa0>,False,https://i.redd.it/e0m8ksgm1c4a1.jpg,HIGHLIGHT,112
raz6ft,houseplants,Gonna scroll past without saying howdy?,0.97,9200,<praw.models.comment_forest.CommentForest object at 0x7f94feae24a0>,False,https://i.redd.it/act2xchrg4481.jpg,HIGHLIGHT,245
pb8djy,houseplants,Explanation for the 'planters without drainage are useless' crowd,0.95,9193,<praw.models.comment_forest.CommentForest object at 0x7f94feb27dc0>,False,https://i.redd.it/fb8r056schj71.jpg,HELP,584
oixhgo,houseplants,My boss told me he had a monstera so I asked for a cutting. This man then explained he’s not good with plants and apologised for the “white bits”. I’m pure buzzing.,0.98,9182,<praw.models.comment_forest.CommentForest object at 0x7f94febbb4c0>,False,https://i.redd.it/zinpvsmntta71.jpg,HIGHLIGHT,228
mhwv45,houseplants,"Huge Xanadu I spotted while walking in Rome (Italy). Lady who takes care of it for scale. The plant is more than 20 years old, survived freezing temperatures and snow!",0.98,9158,<praw.models.comment_forest.CommentForest object at 0x7f94e98463e0>,False,https://i.redd.it/dhxkcmh5rkq61.jpg,HIGHLIGHT,130
jvu0j5,houseplants,"Got my first plants three months ago, so proud to see how much they have grown!",0.98,9118,<praw.models.comment_forest.CommentForest object at 0x7f94e98c8ca0>,False,https://i.redd.it/x36jbxidatz51.jpg,PLANT HOMES,226
h10d1q,houseplants,"Coleus family portrait, featuring miss Rex begonia. 💚",0.94,9098,<praw.models.comment_forest.CommentForest object at 0x7f94e9906f50>,False,https://i.redd.it/4jnp2g65ka451.jpg,PLANT SELFIE,241
mf3eq4,houseplants,I’ve finally finished my plant room.. now I need a new room to fill 💚,0.99,9091,<praw.models.comment_forest.CommentForest object at 0x7f94e99991b0>,False,https://i.redd.it/tj734wdrisp61.jpg,PLANT HOMES,197
hr79fk,houseplants,Wishlist plant achieved: Aglaonema Pictum Tricolor,0.99,9038,<praw.models.comment_forest.CommentForest object at 0x7f94d843c880>,False,https://i.redd.it/qgox2nzfbva51.jpg,HIGHLIGHT,177
lqh1jq,houseplants,Ask me what keeps me going every day,0.98,9040,<praw.models.comment_forest.CommentForest object at 0x7f94d84b0cd0>,False,https://i.imgur.com/actu3Bw.jpg,PETS AND PLANTS,165
hf2mha,houseplants,So.... My wife got a new hobby during the quarantine,0.98,9015,<praw.models.comment_forest.CommentForest object at 0x7f94c821a440>,False,https://i.redd.it/k74m2qsniv651.jpg,PLANT HOMES,232
ssmorq,houseplants,"I lost my whole plant collection last year to my abusive ex, he burned most of them and it was very traumatic. I had built up an expensive collection. I’m finally in a safe place and got my first plant today to start over. Here is to new beginnings ❤️",0.97,9008,<praw.models.comment_forest.CommentForest object at 0x7f94c828c6d0>,False,https://i.redd.it/l5ls1p5kfvh81.jpg,PLANT HOMES,289
ge09l0,houseplants,Today’s morning sun was just glorious,0.98,8998,<praw.models.comment_forest.CommentForest object at 0x7f94e9a0b3a0>,False,https://i.redd.it/ddmnb78bxyw41.jpg,PLANT HOMES,118
fqr144,houseplants,One absolute fucking unit of a fern at my local greenhouse. 100 years old.,0.98,8996,<praw.models.comment_forest.CommentForest object at 0x7f94e9abefb0>,False,https://i.redd.it/bo0817x7wgp41.jpg,HUMOR/FLUFF,163
omqsns,houseplants,My lemon finally turned yellow... after months of my family making fun of it for really being a lime tree!,0.99,8998,<praw.models.comment_forest.CommentForest object at 0x7f94c830c9d0>,False,https://i.redd.it/v5anwwdq6zb71.jpg,HIGHLIGHT,206
zcs6j8,houseplants,Christmas Snake,0.98,8967,<praw.models.comment_forest.CommentForest object at 0x7f94c836df90>,False,https://i.imgur.com/nTVnEgL.jpg,PLANT HOMES,87
okxzbf,houseplants,At least I have that one leaf to look at..,0.98,8971,<praw.models.comment_forest.CommentForest object at 0x7f94c83eb370>,False,https://i.redd.it/v6u55d3azeb71.jpg,HUMOR/FLUFF,146
m6yedt,houseplants,When your girlfriend keeps coming home with plants you can either argue or just admit defeat and build a plant stand..,0.98,8965,<praw.models.comment_forest.CommentForest object at 0x7f94febd6440>,False,https://i.redd.it/v928qeqzqkn61.jpg,PLANT HOMES,250
gteu9p,houseplants,This popped up on Facebook and I had my own TIL moment,0.97,8957,<praw.models.comment_forest.CommentForest object at 0x7f94fec35690>,False,https://i.redd.it/f9yfiqmatw151.jpg,HUMOR/FLUFF,109
kuepb5,houseplants,I made another shelf for above the dresser and now this side of my room looks more complete 🪴,0.98,8959,<praw.models.comment_forest.CommentForest object at 0x7f955a205810>,False,https://i.redd.it/0a69z75geia61.jpg,PETS AND PLANTS,190
ni7ala,houseplants,It be like that sometimes,0.99,8937,<praw.models.comment_forest.CommentForest object at 0x7f955a2369b0>,False,https://i.redd.it/qs34clk4mk071.jpg,HUMOR/FLUFF,172
ndn3si,houseplants,So proud i caught this bloom this morning,0.99,8940,<praw.models.comment_forest.CommentForest object at 0x7f955a2b2650>,False,https://v.redd.it/ujzlzs3i5hz61,PLANT HOMES,102
il72bw,houseplants,Today I reached Peak Millenial as my sourdough starter overflows onto my String of Dolphins,0.96,8940,<praw.models.comment_forest.CommentForest object at 0x7f94d8567f70>,False,https://i.redd.it/csntkcb1oqk51.jpg,HIGHLIGHT,138
ihwg09,houseplants,my pilea has become an absolute unit,0.98,8934,<praw.models.comment_forest.CommentForest object at 0x7f94d856c520>,False,https://i.redd.it/mxyumkzjumj51.jpg,HIGHLIGHT,157
g50dwk,houseplants,"On Saturday afternoon I went downstairs to the lobby of my apartment building to grab my mail and I noticed these in the corner with a ""FREE"" sign on them – pots and all! Needless to say they have a new home :)",0.98,8926,<praw.models.comment_forest.CommentForest object at 0x7f94c8423f70>,False,https://i.redd.it/79fvev0471u41.jpg,HAUL,224
ka38rm,houseplants,My local plant store has this great chart showing light and watering needs for each type of plant,0.98,8915,<praw.models.comment_forest.CommentForest object at 0x7f94e9c5bfd0>,False,https://i.redd.it/jo8gp2f3w8461.jpg,DISCUSSION,231
zdoxrs,houseplants,It's really giving off some jungle vibes in here,0.97,8877,<praw.models.comment_forest.CommentForest object at 0x7f94e9c64400>,False,https://i.redd.it/o6nn7blsm74a1.jpg,PLANT HOMES,151
ik4iop,houseplants,Plant life in corona,0.99,8877,<praw.models.comment_forest.CommentForest object at 0x7f94c851abf0>,False,https://i.redd.it/3lmx4lpwzck51.jpg,PLANT HOMES,106
10mqze5,houseplants,What do y’all think about my money tree?,0.97,8876,<praw.models.comment_forest.CommentForest object at 0x7f94c8566890>,False,https://i.redd.it/izq3ts4rznea1.jpg,Discussion,547
g95l3w,houseplants,Family photo! It’s rare that we’re able to get everyone together in the same room.,0.97,8874,<praw.models.comment_forest.CommentForest object at 0x7f94c85b3040>,False,https://i.redd.it/i901y9ioeev41.jpg,HIGHLIGHT,285
sq60ar,houseplants,Can you guess why I got pulled over?,0.98,8872,<praw.models.comment_forest.CommentForest object at 0x7f953aaa32b0>,False,https://v.redd.it/d1gljifxx8h81,HUMOR/FLUFF,348
fs6m2c,houseplants,Here’s my spathiphyllum sensation...again. I’m obsessed. Coworkers and fam are sick of hearing about it lol,0.98,8854,<praw.models.comment_forest.CommentForest object at 0x7f953ab421d0>,False,https://v.redd.it/sjm5f62utxp41,HIGHLIGHT,151
ldwb7l,houseplants,My plumeria reminded me of someone. 😊,0.98,8830,<praw.models.comment_forest.CommentForest object at 0x7f94d89cd9f0>,False,https://i.redd.it/7qtm9epijuf61.jpg,HUMOR/FLUFF,54
lvjwqi,houseplants,My living room plants,0.98,8829,<praw.models.comment_forest.CommentForest object at 0x7f94d8a1a4a0>,False,https://i.redd.it/ymajtf40ahk61.jpg,PLANT HOMES,195
fe0hgo,houseplants,Me not owning any plants but still enjoying this subreddit,0.98,8825,<praw.models.comment_forest.CommentForest object at 0x7f94d8a32bc0>,False,https://m.imgur.com/mCGPT3v?r,HUMOR/FLUFF,145
kf162x,houseplants,Just finished making my wife’s first Christmas present. Now we have AIR PLANT JELLYFISH!,0.98,8787,<praw.models.comment_forest.CommentForest object at 0x7f94d8abaa70>,False,https://www.reddit.com/gallery/kf162x,PLANT HOMES,152
kzvwy6,houseplants,I can’t get enough green in my space. Happy Monstera Monday!,0.98,8751,<praw.models.comment_forest.CommentForest object at 0x7f94d8b0a2c0>,False,https://i.redd.it/hw94t3c4s3c61.jpg,ART,97
10qum7b,houseplants,14 year old Peace Lily at our local tire shop.,0.98,8751,<praw.models.comment_forest.CommentForest object at 0x7f94fefea410>,False,https://i.redd.it/u08ok1gjdmfa1.jpg,Plant Homes,162
jlo9wl,houseplants,Halloween costume contest 🌱💁‍♀️,0.97,8745,<praw.models.comment_forest.CommentForest object at 0x7f94ff025e70>,False,https://i.redd.it/ja8y2ahschw51.jpg,HUMOR/FLUFF,82
t5txce,houseplants,I've been working on this dried leaf display for the past two years and wanted to share my progress.,0.96,8728,<praw.models.comment_forest.CommentForest object at 0x7f94ff0971f0>,False,https://i.redd.it/p5qrljwkr6l81.jpg,HIGHLIGHT,190
inn6d3,houseplants,my bedroom is better than therapy 🤍🌱,0.96,8708,<praw.models.comment_forest.CommentForest object at 0x7f94e9cfdb40>,False,https://i.redd.it/35ztqoj7ijl51.jpg,PETS AND PLANTS,192
gqvm91,houseplants,My Mom’s 11 year old Pothos!,0.98,8703,<praw.models.comment_forest.CommentForest object at 0x7f94e9d6d990>,False,https://i.redd.it/2nzeht9wl3151.jpg,HIGHLIGHT,122
xqclmj,houseplants,Flowers all year long - why aren't these plants more popular?,0.97,8688,<praw.models.comment_forest.CommentForest object at 0x7f94e9de1360>,False,https://i.redd.it/sf1meetqolq91.jpg,DISCUSSION,594
129tatl,houseplants,The best environment for a calathea is in fact a trashcan. Perfect humidity and optimal lighting.,0.95,8678,<praw.models.comment_forest.CommentForest object at 0x7f94c8638af0>,False,https://i.redd.it/8igdnpoo0kra1.png,Humor/Fluff,368
107gwsc,houseplants,Annual pic of Calamondin Orange,0.98,8668,<praw.models.comment_forest.CommentForest object at 0x7f94ff157c10>,False,https://i.redd.it/l61dsjhgb1ba1.jpg,PLANT HOMES,195
ubserr,houseplants,I rotate you every other day… yet you continue to grow in one direction…… you look RIDICULOUS,0.98,8656,<praw.models.comment_forest.CommentForest object at 0x7f94ff157b20>,False,https://i.redd.it/adbnzrdr1qv81.jpg,HIGHLIGHT,291
ivrja1,houseplants,Dad and his umbrella plant,0.98,8652,<praw.models.comment_forest.CommentForest object at 0x7f94ff1bb820>,False,https://i.redd.it/9guw3wu0k3o51.jpg,HIGHLIGHT,110
137lbn6,jobs,Why do employers force you to work in office all week for a job that can easily be done at home?,0.9,8637,<praw.models.comment_forest.CommentForest object at 0x7f94d8be6fe0>,False,https://www.reddit.com/r/jobs/comments/137lbn6/why_do_employers_force_you_to_work_in_office_all/,Work/Life balance,1707
mogwld,houseplants,My big Monstera!,0.99,8619,<praw.models.comment_forest.CommentForest object at 0x7f94d8c20100>,False,https://i.imgur.com/MyrsWHs.jpg,HIGHLIGHT,118
p6eyn3,houseplants,relatable,0.98,8611,<praw.models.comment_forest.CommentForest object at 0x7f94c8aed390>,False,https://i.redd.it/w29g6n1e30i71.jpg,HUMOR/FLUFF,119
gzr491,houseplants,The wife’s plant room keeps growing!,0.98,8611,<praw.models.comment_forest.CommentForest object at 0x7f94c8b1b0d0>,False,https://i.redd.it/vh3txzt61x351.jpg,PLANT HOMES,163
nh1bf6,houseplants,This pot was made for this plant! 😍,0.99,8606,<praw.models.comment_forest.CommentForest object at 0x7f94c8b64670>,False,https://i.redd.it/g3ervdfy9a071.jpg,HUMOR/FLUFF,127
12lyyoi,houseplants,My pothos and I,0.91,8591,<praw.models.comment_forest.CommentForest object at 0x7f94ff25bfd0>,False,https://www.reddit.com/gallery/12lyyoi,People: FRIDAYS ONLY,293
kob68f,houseplants,Happy New Year everyone! These are the plants I have cared for since July!,0.97,8593,<praw.models.comment_forest.CommentForest object at 0x7f94ff2604f0>,False,https://i.redd.it/xdgqfp2p1q861.jpg,FAMILY PHOTO,141
lggtwy,houseplants,This is one of the most beautiful plant I’ve ever seen.,0.99,8582,<praw.models.comment_forest.CommentForest object at 0x7f94c874fdf0>,False,https://i.imgur.com/SufekAE.jpg,,203
jvbu1t,houseplants,Set up my Christmas tree last night. 🌿🎄,0.98,8578,<praw.models.comment_forest.CommentForest object at 0x7f94c879b460>,False,https://i.redd.it/8lyw6fbr8nz51.jpg,HIGHLIGHT,146
rhs950,houseplants,One of you guys on the subway during covid be like...,0.97,8565,<praw.models.comment_forest.CommentForest object at 0x7f94e9e0e5f0>,False,https://i.redd.it/uc0zmt3u3x581.jpg,HUMOR/FLUFF,149
xxwno7,houseplants,"i was in a deep depression this spring, i bought my first plant. Now i still have depression but ive got alot of plants! 👌",0.98,8555,<praw.models.comment_forest.CommentForest object at 0x7f94e9e5e440>,False,https://www.reddit.com/gallery/xxwno7,DISCUSSION,324
ie1ivz,houseplants,"It was a nerve-wracking 3 mile ride home, but we made it!",0.99,8548,<praw.models.comment_forest.CommentForest object at 0x7f94e9ebe170>,False,https://i.redd.it/vwhux3x18ei51.jpg,HAUL,112
kthqzi,houseplants,"Millennials be like ""Family photo"" 🤘💚🐺",0.97,8551,<praw.models.comment_forest.CommentForest object at 0x7f94c889c1c0>,False,https://i.imgur.com/5eBEjNI.jpg,FAMILY PHOTO,136
hi9hl1,houseplants,My “zen den” aka favorite spot in the house with my plants June 2019 (top) to June 2020 (bottom) 🥰,0.97,8536,<praw.models.comment_forest.CommentForest object at 0x7f94c88cd570>,False,https://i.redd.it/8err1v8f5x751.jpg,PLANT HOMES,177
mk3zw4,houseplants,My cactus bloomed!,0.99,8534,<praw.models.comment_forest.CommentForest object at 0x7f94c8b8ca90>,False,https://www.reddit.com/gallery/mk3zw4,HIGHLIGHT,115
n6il73,houseplants,Found this excellent new home for my air plants,0.99,8529,<praw.models.comment_forest.CommentForest object at 0x7f94c8bfae30>,False,https://i.redd.it/xw1ie4nplkx61.jpg,PLANT HOMES,98
i97fnl,houseplants,As promised.. Here is Part Two of my watercolor houseplant collection series,0.98,8518,<praw.models.comment_forest.CommentForest object at 0x7f94ff2cfee0>,False,https://i.redd.it/hdj8ujosvtg51.jpg,ART,222
m5qe7n,houseplants,20% of this pandemic has been spent rearranging plants.,0.98,8512,<praw.models.comment_forest.CommentForest object at 0x7f94ff2d45e0>,False,https://i.redd.it/1gmmltp1c8n61.jpg,FAMILY PHOTO,119
hm71k5,houseplants,Missed it’s watering schedule by 12 hours and it acted like it died...,0.98,8515,<praw.models.comment_forest.CommentForest object at 0x7f94ff351db0>,False,https://i.redd.it/2w933z35h8951.jpg,HUMOR/FLUFF,247
10gm4er,houseplants,70 year old Christmas cactus!,0.99,8501,<praw.models.comment_forest.CommentForest object at 0x7f94ff387e50>,False,https://i.redd.it/lq9mxsmfs5da1.jpg,HIGHLIGHT,135
